dates,titles
"Oct 24, 2021",NewsWatch: Big Tech stocks are the market's superstars but rising rates could bring them down
"Oct 24, 2021",bZx Protocol (BZRX) Price Hits $0.33 on Top Exchanges
"Oct 24, 2021",bZx Protocol Price Reaches $0.33 on Exchanges (BZRX)
"Oct 23, 2021",Inside the Courts - An Update From Skadden Securities Litigators - October 2021
"Oct 23, 2021",What's The Deal With Well Everything?!!
"Oct 22, 2021",Stocks Mostly Advance As Evergrande Fears Recede
"Oct 22, 2021",Stocks Rebound On Evergrande Boost
"Oct 22, 2021",Stocks Split As Evergrande Fears Recede
"Oct 22, 2021",Animal Spirits: It Wasn't Transitory
"Oct 21, 2021","Alabama: App may help cut long stadium food, drink lines"
"Oct 21, 2021",Cathie Wood's ARK Invest Sells for 10/21
"Oct 21, 2021",Gartner Executive Poll Finds More Are Worried About Ransomware Than Pandemic
"Oct 21, 2021","Insider Selling: HIVE Blockchain Technologies Ltd. (CVE:HIVE) Senior Officer Sells 5,000 Shares of Stock"
"Oct 21, 2021","Insider Selling: HIVE Blockchain Technologies Ltd. (CVE:HIVE) Senior Officer Sells C$17,850.00 in Stock"
"Oct 21, 2021",Tesla Reports $51M Bitcoin-Related Impairment Loss In Q3
"Oct 21, 2021","Stocks Mostly Fall, Bitcoin Retreats"
"Oct 21, 2021","Stocks Fall, Bitcoin Close To Record High"
"Oct 21, 2021","Stocks Fall, Bitcoin Retreats"
"Oct 20, 2021",Futures Slide On Stagflation Fears As 10Y Yields Spike
"Oct 20, 2021",2021 Cybersecurity Attacks that are Threatening Businesses
"Oct 20, 2021","Asian Markets Mixed, Hong Kong Drops As Evergrande Sale Fails"
"Oct 20, 2021","Finding the Last Squeeze-able Stocks in the Commodity Space (BTU, CEI, CHK, FCX, PAAS, TECK, WY)"
"Oct 20, 2021","FTSE 100 seen lower ahead of Thursday's open, jitters for Asian and European markets"
"Oct 20, 2021",Tesla profits surge on higher auto sales despite chip crunch
"Oct 20, 2021",Tesla Profits Surge On Higher Auto Sales Despite Chip Crunch
"Oct 20, 2021",Tesla revenues and profits still go up a gear despite supply chain headwinds
"Oct 20, 2021","Thursday Afternoon Analyst Upgrades and Downgrades: Bandwidth, Live Nation, Krispy Kreme, Twilio, Zendesk and More"
"Oct 20, 2021","Bitcoin strikes record high, stocks steady"
"Oct 20, 2021","European stocks steady, as bitcoin nears record high"
"Oct 20, 2021","Powell's Reappointment, Central Bank Balance Sheets And Bitcoin"
"Oct 20, 2021","Bitcoin Strikes Record High, Stocks Advance"
"Oct 20, 2021","Bitcoin Strikes Record High, Stocks Steady"
"Oct 19, 2021",Financial Daily Dose 10.20.2021 | Top Story: Credit Suisse Fined $475M Over Mozambique Bribery Scandal
"Oct 19, 2021",bZx Protocol 1-Day Trading Volume Tops $26.08 Million (BZRX)
"Oct 19, 2021",Mid-Afternoon Market Update: Nasdaq Turns Lower; Sesen Bio Shares Surge
"Oct 19, 2021","SHPING Hits 1-Day Trading Volume of $94,471.00 (SHPING)"
"Oct 19, 2021",SHPING (SHPING) Price Tops $0.0017
"Oct 19, 2021","Stocks edge higher on Wall Street, led by health care"
"Oct 19, 2021","Stocks rise on Wall Street, S&P 500 hovers around high"
"Oct 19, 2021","Stocks rise on Wall Street, S&P 500 hovers near record high"
"Oct 19, 2021",Earnings Results: Tesla says supply-chain snags keeps its factories from running 'full speed'
"Oct 19, 2021",Market Snapshot: S&P 500 rises on good earnings reports despite supply chain disruptions
"Oct 19, 2021","Tech, health care stocks lead Wall Street indexes higher"
"Oct 19, 2021",Macro Briefing: 19 October 2021
"Oct 19, 2021",bZx Protocol 24-Hour Volume Tops $26.96 Million (BZRX)
"Oct 19, 2021",SHPING (SHPING) Price Hits $0.0017 on Exchanges
"Oct 19, 2021","Darcy Glenn Daubaras Sells 3,000 Shares of HIVE Blockchain Technologies Ltd. (CVE:HIVE) Stock"
"Oct 18, 2021",European stocks waver on rate hike fear
"Oct 18, 2021",Home Building Data Disappoints
"Oct 18, 2021",Home Building Disappoints Last Month; J&J and P&G Beat on Earnings
"Oct 18, 2021","Insider Selling: HIVE Blockchain Technologies Ltd. (CVE:HIVE) Senior Officer Sells 3,000 Shares of Stock"
"Oct 18, 2021",Jim Chanos: China's 'Leveraged Prosperity' Model is Doomed. And That's Not the Worst
"Oct 18, 2021",Neptune Digital Assets (CVE:NDA) Shares Down 3.3%
"Oct 18, 2021","P&G raising prices to offset higher commodity, freight costs"
"Oct 18, 2021",Protect your open source project from supply chain attacks
"Oct 18, 2021",Strong earnings prop up global stocks
"Oct 18, 2021",Strong Earnings Prop Up Global Stocks
"Oct 18, 2021",US links $5.2 billion in Bitcoin transactions to ransomware
"Oct 18, 2021","Midday Meme Stock Report for 10/18: AMC, Coinbase, Greenidge, Robinhood"
"Oct 17, 2021",El Salvador: Thousands march against President Nayib Bukele
"Oct 17, 2021",Sector Detector: Entering Q4 with mix of optimism and caution suggests hedged long positioning
"Oct 17, 2021",ASX up 0.3% to three-week high
"Oct 16, 2021",bZx Protocol (BZRX) Price Up 9.2% Over Last Week
"Oct 16, 2021",Cryptocurrencies Can Undermine Effectiveness Of US Sanctions: Treasury
"Oct 16, 2021",Coinbase's Entry Into The NFT Market Threatens OpenSea's Near Monopoly And Dominance
"Oct 16, 2021","Commerce head out to save US jobs, 1 computer chip at a time"
"Oct 15, 2021",Hut 8 Mining (TSE:HUT) Receives New Coverage from Analysts at DA Davidson
"Oct 15, 2021","Monday Afternoon Analyst Upgrades and Downgrades: Dow, PNC Financial, Steel Dynamics and More"
"Oct 15, 2021",Salvadorans March Against Bukele's Economic And Judicial Policies
"Oct 15, 2021",Salvadorans march against Bukele's economic and judicial policies
"Oct 15, 2021",NewsWatch: The Dow is on track for its best October in 6 years and third-quarter earnings are strong so far. What could go wrong?
"Oct 15, 2021",bZx Protocol Price Reaches $0.34 (BZRX)
"Oct 15, 2021",Company behind Tether 'token' fined $41M by US regulators
"Oct 15, 2021",Hut 8 Mining (TSE:HUT) Stock Price Down 2.9%
"Oct 15, 2021",Tether And Bitfinex Hit With $41M Fine For Lying About Dollar Reserves
"Oct 15, 2021","With Bitcoin At $60K, Consider These Crypto Stocks"
"Oct 15, 2021",Quantifying The Bitcoin Supply Shortage
"Oct 15, 2021","Futures Jump On Profit Optimism As Oil Tops $85; Bitcoin Nears $60,000"
"Oct 15, 2021",The Price Of Oil And Bitcoin Is Surging
"Oct 14, 2021",Gold's Journey Signals To Dollars Instability and Supply Chain Issues
"Oct 14, 2021",Policyholders Hit With Ransomware Strike Insurance Coverage Oil in Indiana
"Oct 14, 2021",bZx Protocol (BZRX) Price Hits $0.30 on Exchanges
"Oct 14, 2021",Macro Briefing: 15 October 2021
"Oct 14, 2021",Mid-Afternoon Market Update: Dow Jumps 400 Points; Alcoa Shares Spike Higher
"Oct 14, 2021",Mid-Day Market Update: Crude Oil Rises 1%; Duck Creek Technologies Shares Plunge
"Oct 14, 2021","Asian Markets Rally As Earnings Offset Inflation, Taper Worries"
"Oct 13, 2021",Global Stocks Extend Rally On Earnings; Brent Oil Hits New Peak
"Oct 13, 2021","HIVE Blockchain Technologies Ltd. (CVE:HIVE) Senior Officer Darcy Glenn Daubaras Sells 3,000 Shares"
"Oct 13, 2021",Hut 8 Mining (TSE:HUT) Trading 7.3% Higher
"Oct 13, 2021",Russian President Vladimir Putin: Bitcoin Has 'Right to Exist'
"Oct 13, 2021",Following The Decade-Long IMF Playbook
"Oct 13, 2021",ONECOIN INVESTORS FROM FAILED NEW YORK LAWSUIT JOIN CLAIMANTS IN LONDON & BRUSSELS
"Oct 13, 2021",Unemployment claims fall to lowest level of pandemic
"Oct 13, 2021",Vident Investment Advisory LLC Makes New Investment in Bitfarms Ltd. (NASDAQ:BITF)
"Oct 13, 2021",Vident Investment Advisory LLC Purchases New Position in Bitfarms Ltd. (NASDAQ:BITF)
"Oct 13, 2021",How Decentralized Identifiers And Bitcoin Fix The Web
"Oct 12, 2021","The Impending Binance Arbitration: a Primer on the World of Cryptocurrencies, Derivatives Trading and Decentralised Finance on the Blockchain"
"Oct 12, 2021",Gates of Vienna News Feed 10/12/2021
"Oct 12, 2021",Gold Forecast: XAU/USD Undecided Ahead Of US Inflation Figures
"Oct 11, 2021",SHPING (SHPING) Price Hits $0.0010
"Oct 11, 2021","HIVE Blockchain Technologies Ltd. (CVE:HIVE) Senior Officer Darcy Glenn Daubaras Sells 3,000 Shares of Stock"
"Oct 11, 2021",Treasury Actions to Counter Ransomware
"Oct 10, 2021",Twitter Inc (NYSE: TWTR) Announces it is testing New Feature That Warns Users When a Conversation Could Get Intense
"Oct 10, 2021",US stocks end mixed as investors digest 3Q earnings and possible Fed tapering
"Oct 10, 2021",SHPING Market Cap Reaches $1.81 Million (SHPING)
"Oct 09, 2021","HIVE Blockchain Technologies Ltd. (CVE:HIVE) Senior Officer Sells C$11,100.00 in Stock"
"Oct 09, 2021",IMF board confident about leader despite data-rigging claims
"Oct 09, 2021",The Bitcoin Mining Hash Rate Is Seeing An Unprecedented Restructuring
"Oct 09, 2021",El Salvador Will Use BTC Profits To Build A Pet Hospital: Report
"Oct 09, 2021",Satoshi's Ark Will Save Bitcoiners
"Oct 08, 2021",Financial Daily Dose 10.8.2021 | Top Story: Tesla Makes Good on Threat to Move HQ from Cali to Texas
"Oct 08, 2021","Monday Afternoon Analyst Upgrades and Downgrades: DraftKings, Taiwan Semiconductor and More"
"Oct 08, 2021",European Union Commission Paid Out €1 Million on Questionable Blockchain Innovation
"Oct 08, 2021",Mutual Funds Weekly: These money and investing tips can help you when Mr. Market climbs a wall of worry
"Oct 08, 2021","SHPING Reaches 1-Day Trading Volume of $372,873.00 (SHPING)"
"Oct 08, 2021","China Bars Its Citizens From Investing In Crypto Mining, Again"
"Oct 08, 2021","Top 10 Fintech News Stories for the Week Ending October 9, 2021"
"Oct 07, 2021",Mt.GOX Voting Deadline For Creditors Has Officially Ended
"Oct 07, 2021",NewsWatch: Tesla's moving to Texas for cheap housing — and could come up short
"Oct 07, 2021",XTX Topco Ltd Makes New Investment in Canaan Inc. (NASDAQ:CAN)
"Oct 07, 2021",Closing The Wealth Gap: Black America And Bitcoin Adoption
"Oct 07, 2021","Bank of Nova Scotia Sells 99,448 Shares of Bit Digital, Inc. (NASDAQ:BTBT)"
"Oct 07, 2021",Celsius Got A $1 Billion Loan From Tether: Report
"Oct 07, 2021",Debt-Limit-Delay Gains Purged On Punk Payrolls; Crypto & Crude Surge
"Oct 07, 2021",EXPLAINER: 5 key takeaways from the September jobs report
"Oct 06, 2021","NewsWatch: U.S. adds just 194,000 jobs in September as delta worsens labor shortage"
"Oct 06, 2021",'Shortages' Aren't Causing Inflation. Money Creation Is.
"Oct 06, 2021",Bitcoin And The Increasing Risk Of Stagflation
"Oct 06, 2021",DOJ Announces Launch Of National Crypto Enforcement Team As FDIC Mulls Insuring Stablecoins
"Oct 05, 2021",Five Items Around Your House That Could Make You a Millionaire
"Oct 05, 2021","Need to Know: Here are the three biggest risks for stocks right now, and the red flags to watch"
"Oct 05, 2021",SHPING (SHPING) Market Capitalization Achieves $2.04 Million
"Oct 05, 2021",A Peek Into The Markets: US Stock Futures Rise; Jobless Claims Data In Focus
"Oct 05, 2021",US stocks close higher on debt-ceiling extension and upbeat jobs data
"Oct 05, 2021",US stocks soar on debt ceiling extension and positive jobs data
"Oct 05, 2021",Bitcoin Coming to Over 700 Commercial Outlets Across El Salvador via RSK-Integrated Kripton Market
"Oct 05, 2021","How Fed Tapering, Energy Crises And China Blackouts Will Impact Bitcoin"
"Oct 05, 2021","The Margin: What teens want: Nike gear, Chipotle burritos and Snapchat"
"Oct 05, 2021","Melinda Gates forms nonfiction book imprint, Moment of Lift"
"Oct 05, 2021",Bitcoin Surpasses Facebook's Market Valuation: What You Should Know
"Oct 05, 2021","China's Ban Is Making Bitcoin Stronger, Edward Snowden Said"
"Oct 05, 2021","If You Invested $1,000 In Riot Blockchain Stock One Year Ago, Here's How Much You'd Have Now"
"Oct 05, 2021",CFTC Charges Crypto Platforms for Registration and Trading Violations
"Oct 04, 2021",Ex-Facebook employee brings sharp criticisms to Congress
"Oct 04, 2021","Ex-Facebook manager criticizes company, urges more oversight"
"Oct 04, 2021",IMF says trimming global growth forecast due to rising risks
"Oct 04, 2021",Mid-Afternoon Market Update: Dow Jumps 450 Points; Comtech Telecommunications Shares Slide
"Oct 04, 2021",Mid-Morning Market Update: Markets Open Higher; PepsiCo Beats Q3 Views
"Oct 02, 2021",Rising Oil Prices and Yields Makes Market Navigation More Complex
"Oct 02, 2021",Spain's government eyes rent controls in new housing bill
"Oct 01, 2021","Stocks open higher, as tech looks to rebound; oil tops $78"
"Oct 01, 2021",Stocks rise on Wall Street as tech rebounds; oil tops $78
"Oct 01, 2021",US stocks end sharply higher as tech recoups some losses
"Oct 01, 2021",What Industries Have Started to Adopt Cryptocurrency?
"Oct 01, 2021",Tesla and Merck Give Investors Some Hope
"Sep 30, 2021","Washington Watch: Crypto complex recalls 1920s stock market with 'rampant speculation, manipulation and theft,' says left-leaning think tank"
"Sep 30, 2021",SHPING (SHPING) Trading 142.3% Higher Over Last 7 Days
"Sep 30, 2021",Apple quietly adds an App Store feature for reporting scam apps
"Sep 30, 2021",SHPING (SHPING) Price Tops $0.0015 on Major Exchanges
"Sep 30, 2021",Dubai Expo 2020 offers conflicting figures on worker deaths
"Sep 30, 2021","Bitcoin. Silver and Gold Price, October Market Update"
"Sep 30, 2021",US Has No Plans To Ban Bitcoin Or Crypto: Fed Chair Powell
"Sep 29, 2021",SHPING (SHPING) Market Capitalization Achieves $1.29 Million
"Sep 29, 2021",SHPING (SHPING) Trading Down 38.1% This Week
"Sep 29, 2021","Insider Buying: Mode Global Holdings PLC (LON:MODE) Insider Acquires 2,850 in Stock"
"Sep 28, 2021","Bitcoin, Evergrande And The Deteriorating Situation In China"
"Sep 28, 2021",bZx Protocol Trading Down 4.5% Over Last 7 Days (BZRX)
"Sep 28, 2021","Euro and Inflation Outlook: Recovery Strong, Prices And Yields Alarming"
"Sep 28, 2021","Midday Meme Stock Report for 9/29: Camber Energy, Greenidge, IronNet, TMC"
"Sep 28, 2021",Bridgefront Capital LLC Acquires New Holdings in Canaan Inc. (NASDAQ:CAN)
"Sep 27, 2021","Bridgefront Capital LLC Invests $82,000 in Canaan Inc. (NASDAQ:CAN)"
"Sep 27, 2021",Senators push Facebook exec on Instagram policies for youth
"Sep 27, 2021",Why Are Bitcoin Mining ASIC Prices Surging And Where Will They Go Next?
"Sep 27, 2021","Global Payments Newsletter, September 2021"
"Sep 27, 2021","Mode Global Holdings PLC (LON:MODE) Insider Edward Richard Ambrose Walker- Morecroft Acquires 7,500 Shares"
"Sep 27, 2021",Links 9/28/2021
"Sep 27, 2021",Texas progressives look at Paxton's fraudit and more
"Sep 27, 2021",Markets Post Worst Trading Day in Months
"Sep 27, 2021","Neptune Digital Assets Corp. (CVE:NDA) Director Dario Meli Purchases 40,000 Shares"
"Sep 27, 2021","Neptune Digital Assets Corp. (CVE:NDA) Director Purchases C$22,000.00 in Stock"
"Sep 27, 2021",Bitcoin Falls On China's Crypto Crackdown. Are These Crypto Stocks Better Picks?
"Sep 27, 2021","Guidance Issued to Crypto-Trading Platforms on Requirements relating to Advertising, Marketing and Social Media Use"
"Sep 27, 2021",bZx Protocol (BZRX) Trading Down 6.7% This Week
"Sep 26, 2021","Financial Institutions Pursue Cryptocurrency and Blockchain Offerings, US Treasury Sanctions Russian Crypto OTC Desk, Multiple DeFi Platforms Hacked"
"Sep 26, 2021",US stocks slow their roll at Monday's close
"Sep 26, 2021",What If You Bought 100 Shares of These Companies at the Start?
"Sep 26, 2021",Asian markets start week with gains but eyes on Evergrande
"Sep 26, 2021",Asian Markets Start Week With Gains But Eyes On Evergrande
"Sep 25, 2021",Canaccord Genuity Begins Coverage on Hut 8 Mining (TSE:HUT)
"Sep 25, 2021","Meme Stock Movers for 9/27: Camber Energy, Canoo, SmileDirectClub, TMC"
"Sep 25, 2021","Several Apple, Tesla, and Qualcomm suppliers halt production amid China energy use restrictions"
"Sep 25, 2021",US Markets mixed at midday as oil prices rally
"Sep 25, 2021",Guest Contribution: 'El Salvador exemplifies the surrealism of cryptocurrencies'
"Sep 25, 2021",Gates of Vienna News Feed 9/25/2021
"Sep 24, 2021",bZx Protocol (BZRX) Market Capitalization Achieves $75.81 Million
"Sep 24, 2021","SHPING Tops 24 Hour Volume of $62,683.00 (SHPING)"
"Sep 24, 2021",bZx Protocol (BZRX) Achieves Market Cap of $76.44 Million
"Sep 24, 2021",bZx Protocol Market Capitalization Reaches $79.70 Million (BZRX)
"Sep 24, 2021",Market Snapshot: U.S. stocks end steady but post gains for week after volatile trading
"Sep 24, 2021",Stay Away from Wall Street Gold
"Sep 24, 2021",Black Coffee: Playing With Fire
"Sep 24, 2021",ETH Takes BTC Along On A Decline As China Intensifies The Crackdown
"Sep 24, 2021","Personal Finance Daily: The history and politics behind the Evergrande debt crisis, and new-home sales turn higher, despite record prices"
"Sep 24, 2021","China declares all cryptocurrency transactions illegal, Bitcoin price plummets"
"Sep 24, 2021",Financial Daily Dose 9.24.2021 | Top Story: China Rocks Digital Currency World by Banning Crypto Transactions
"Sep 24, 2021","Meme Stock Movers for 9/24: Aterian, BlackBerry, Camber Energy, Canoo, TMC, and More"
"Sep 23, 2021",China deems all cryptocurrency transactions illegal
"Sep 23, 2021",Futures Slide Alongside Cryptocurrencies Amid China Crackdown
"Sep 23, 2021",Piercing the Sky: Where Will We See the Black Gold by Xmas?
"Sep 23, 2021",Bit Digital (NASDAQ:BTBT) Shares Down 5.5%
"Sep 23, 2021",Global Stocks Mostly Fall On Renewed Evergrande Fears
"Sep 23, 2021",Mid-Afternoon Market Update: Dow Rises 40 Points; Meredith Shares Spike Higher
"Sep 23, 2021",Mid-Day Market Update: Aehr Test Systems Surges Following Q1 Results; Onconova Therapeutics Shares Slide
"Sep 23, 2021",Soaring Stocks Shrug Off Debt Ceiling Doubts As Taper Tantrum Sparks Bond Bloodbath
"Sep 23, 2021","Stocks end mixed on Wall Street, S&P 500 manages weekly gain"
"Sep 23, 2021",Stocks Retreat On Renewed Evergrande Fears
"Sep 23, 2021",Bitcoin.Org Was Hacked Via Fake Crypto Giveaway Scams: Report
"Sep 22, 2021",ARK's Cathie Wood At SALT New York 2021
"Sep 22, 2021",B&Q Owner Kingfisher Nails Demand For DIY
"Sep 22, 2021",Evergrande's share price collapse: The world's biggest no-big-deal default
"Sep 22, 2021",FTSE 100 in positive territory ahead of Bank of England decision but UK growth slows in September
"Sep 22, 2021","FTSE 100 slips into the red as Bank split on bond buying widens, while Wall Street set for opening rise"
"Sep 22, 2021","FTSE 100 virtually flat after Bank of England hints at monetary tightening, but Wall Street moves higher"
"Sep 22, 2021","FTSE 100 virtually unchanged as Bank split on bond buying widens, while Wall Street set for opening rise"
"Sep 22, 2021",National Express And Stagecoach In Talks For All Share Merger
"Sep 22, 2021",OFAC Issues New Ransomware Guidance And First Sanctions Designation Against Virtual Currency Exchange
"Sep 22, 2021",US jobless claims tick up from near a pandemic low
"Sep 22, 2021","Bitcoin Price Shockingly Plunges To $5,402 After Pyth Error"
"Sep 22, 2021","Data Platform Error Shows Bitcoin Crash To $5,400, Triggering DeFi Liquidation Wave"
"Sep 22, 2021",BTC Slid 6% As Ethereum Reaches New Two-Month Low At $3000
"Sep 21, 2021",bZx Protocol Market Cap Tops $75.12 Million (BZRX)
"Sep 21, 2021",SHPING (SHPING) Price Reaches $0.0013 on Exchanges
"Sep 21, 2021",Van ECK Associates Corp Buys New Holdings in Hut 8 Mining Corp. (NYSE:HUT)
"Sep 21, 2021","Van ECK Associates Corp Buys Shares of 322,244 Hut 8 Mining Corp. (NYSE:HUT)"
"Sep 21, 2021",California man charged with perjury in Hollywood execs suit
"Sep 21, 2021",Financial Daily Dose 9.22.2021 | Top Story: DOJ Files Antitrust Suit Against American Airlines and Jet Blue Over Growing Alliance
"Sep 21, 2021",Gates of Vienna News Feed 9/21/2021
"Sep 20, 2021",Northern District of California Dismisses Traders' Suit Against Bitmex Crypto Exchange with Prejudice
"Sep 20, 2021",Offshore Creditors Remain In Limbo As Evergrande Agrees To Pay Thursday's Interest On Local Bonds Only
"Sep 20, 2021","Report: Suspected Chinese hack targets Indian media, gov't"
"Sep 20, 2021",Robinhood Is Testing Bitcoin and Crypto Withdrawal Feature And New Digital Wallet
"Sep 20, 2021",Mogo (TSE:MOGO) Shares Down 7%
"Sep 20, 2021",SHPING Price Down 13.8% Over Last Week (SHPING)
"Sep 20, 2021",BlackMatter demands $5.9 million ransom from Iowa farm cooperative
"Sep 20, 2021",Chinese construction giant Evergrande could collapse in one of history's largest defaults
"Sep 20, 2021",Coinbase Canceled Plans To Launch LEND Product After SEC Lawsuit
"Sep 20, 2021",US Sanctions Crypto Exchange Over Ransomware Ties
"Sep 20, 2021","Meme Stock Movers for 9/20: AMC, Greenidge, Hut 8, Marathon Digital, SmileDirectClub"
"Sep 20, 2021","Prudential - New Chapter, New Checks"
"Sep 19, 2021",Total Construction Starts Decline In August
"Sep 19, 2021",Coinbase Drops Crypto Lending Program Plans After SEC Warning
"Sep 19, 2021","Midday Meme Stock Report for 9/20: Aterian, Bit Mining, Greenidge, Offerpad"
"Sep 19, 2021",SHPING Achieves Market Capitalization of $2.37 Million (SHPING)
"Sep 18, 2021","Stocks drop the most since May on worries over China, Fed"
"Sep 18, 2021","The taper, when it comes, will feel like a relief"
"Sep 18, 2021",UK government holds emergency talks to bolster energy firms
"Sep 17, 2021",US Stock Exchange: S&P Falls 1.7% and Dow Drops Over 600 Points
"Sep 17, 2021",What You Need To Know About Twitter's $809.5M Settlement Agreement
"Sep 17, 2021",bZx Protocol (BZRX) Price Reaches $0.33 on Top Exchanges
"Sep 17, 2021","The Zacks Analyst Blog Highlights: Eagle Bulk Shipping, Build-A-Bear Workshop, Genco Shipping & Trading, Bluegreen Vacations and Alpha and Omega Semiconductor"
"Sep 17, 2021","Zacks Industry Outlook Highlights: PVH, Ralph Lauren, Columbia Sportswear, Hanesbrands and Under Armour"
"Sep 16, 2021",bZx Protocol (BZRX) Trading Up 6.4% Over Last 7 Days
"Sep 16, 2021",BTC Lender Celsius Joined BlockFi On New Jersey's Target List: Report
"Sep 16, 2021",CFTC Starts Investigation On Binance Over Insider Trading Reports
"Sep 16, 2021","Final Deadline Approaching on September 20, 2021: Kessler Topaz Meltzer & Check, LLP Reminds Coinbase Global Inc. Investors of Class Action Lawsuit Deadline"
"Sep 16, 2021",Is South Korea's Regulatory Crackdown Taking Toll On Bitcoin Price?
"Sep 16, 2021",Mark Cuban Argues Crypto Regulation 'Not A Bad Thing' As Controversy With NFT Platform Opeansea Sparks Worries
"Sep 16, 2021","SHPING Tops One Day Trading Volume of $203,527.00 (SHPING)"
"Sep 16, 2021","Hut 8 Mining Corp. (TSE:HUT) Insider Bitfury Holding B.V. Sells 206,490 Shares"
"Sep 16, 2021","Hut 8 Mining Corp. (TSE:HUT) Insider Sells C$2,466,000.00 in Stock"
"Sep 16, 2021",Lebanon's incoming government restarts central bank audit
"Sep 15, 2021",Adoption of Bitcoin as legal currency sparks protests in El Salvador
"Sep 15, 2021",Salvadorans march against bitcoin and 'dictatorship'
"Sep 15, 2021","Creative Planning Makes New $52,000 Investment in Bitfarms Ltd. (NASDAQ:BITF)"
"Sep 15, 2021",FTSE 100 seen a sliver higher ahead of Thursday's open
"Sep 15, 2021",Hut 8 Mining (TSE:HUT) Trading Down 6.7% After Insider Selling
"Sep 15, 2021","Metals Stocks: Gold faces sharpest daily drop in nearly six weeks as dollar, Treasury yields edge up"
"Sep 14, 2021",US market declines as data gives mixed signals on economy
"Sep 14, 2021",US stocks end mixed session on upbeat retail sales data and worse-than-expected jobless claims
"Sep 14, 2021",US Stocks End Mostly Lower Thursday
"Sep 14, 2021",Wall Street opens mixed as traders mull over latest economic data
"Sep 14, 2021",Salvadorans March Against Bitcoin And 'Dictatorship'
"Sep 14, 2021",August industrial output slows to 0.4% gain after Ida strike
"Sep 14, 2021","Bitfury Holding B.V. Sells 200,000 Shares of Hut 8 Mining Corp. (TSE:HUT) Stock"
"Sep 14, 2021","Hut 8 Mining Corp. (TSE:HUT) Insider Bitfury Holding B.V. Sells 200,000 Shares of Stock"
"Sep 13, 2021",Hut 8 Mining (TSE:HUT) Shares Down 6.7% Following Insider Selling
"Sep 13, 2021",Rafferty Asset Management LLC Invests $3.75 Million in BIT Mining Limited (NYSE:BTCM)
"Sep 13, 2021",Bitcoin Fixes The Modern Fiat Ponzi Scheme
"Sep 13, 2021",SEC Focuses on Crypto Asset Trading Platforms
"Sep 13, 2021",Tame Inflation And The Risk-On Fuse
"Sep 13, 2021",Hedge Fund Managers Were Up 0.80% In August
"Sep 13, 2021",SHPING (SHPING) Price Up 57.6% This Week
"Sep 11, 2021",Amazon brings palm-swiping tech to Red Rocks concert venue
"Sep 11, 2021",Treasury Department Seeks to Track Financial Transactions of Personal Bank Accounts Over $600
"Sep 10, 2021",UK payrolls above pre-pandemic level and job vacancies soar
"Sep 10, 2021",Where Are The Fireworks?
"Sep 10, 2021",New US Digital Assets Bill Casts Wide Net
"Sep 10, 2021",Free Forex Signals and Forecast: Buy USD/CAD - 13 September 2021
"Sep 10, 2021",Gibson Dunn Offers 2021 Mid-Year Securities Litigation Update
"Sep 10, 2021",FCA Chair urges crackdown on cryptoasset promotions as regulators grapple with longer-term crypto regulation
"Sep 10, 2021","Meme Stock Movers for 9/13: AMC, Aterian, Camber Energy, Support.com"
"Sep 10, 2021","Mitsubishi UFJ Kokusai Asset Management Co. Ltd. Invests $273,000 in Bit Digital, Inc. (NASDAQ:BTBT)"
"Sep 10, 2021",Jobless Numbers Fall: Is the Economy Back to Normal?
"Sep 10, 2021",SHPING Market Capitalization Tops $1.59 Million (SHPING)
"Sep 10, 2021","Bitcoin Prevents Monetary Control, Whether Those In Control Like It Or Not"
"Sep 10, 2021","Another Leveraged Crypto Borrowing Binge is Underway, Guaranteed to Blow Up"
"Sep 10, 2021",EUR/USD steady at 1.1830 as the market awaits the US PPI report
"Sep 10, 2021",Financial Daily Dose 9.9.2021 | Top Story: SEC Threatens Action Against Coinbase Over Interest-Earning Product
"Sep 10, 2021","AeroVironment (AVAV) Reports Loss in Q1, Sales Improve Y/Y"
"Sep 10, 2021","Affirm's (AFRM) Q4 Earnings Miss, Revenues Beat, Stock Gains"
"Sep 10, 2021",Aspen Technology (AZPN) Up 1.7% Since Last Earnings Report: Can It Continue?
"Sep 10, 2021",Bear of the Day: Ollies Bargain Outlet (OLLI)
"Sep 10, 2021","BeyondSpring Inc. (BYSI) Reports Q2 Loss, Misses Revenue Estimates"
"Sep 10, 2021",Bull of the Day: Best Buy (BBY)
