dates,titles
"May 13, 2021",US Indexes Rebound for Higher Close Thursday
"May 13, 2021",Tesla's Elon Musk halts use of bitcoin for car purchases
"May 13, 2021",Australian Bitcoin 'creator' files UK lawsuit to retrieve $5.6B cryptocurrency fortune
"May 13, 2021",US Stocks Rebound As CDC Lifts Mask Requirements; Bitcoin Tumbles
"May 13, 2021",Dow jumps 433 points as investors cheer upbeat labor-market data
"May 13, 2021",$4 Billion Of BTC Got Liquidated After Tesla's Announcement
"May 13, 2021",Elon Musk's Tesla will stop accepting Bitcoins due to its impact on the environment
"May 13, 2021",US stocks rally as jobless claims hit another pandemic-era low
"May 13, 2021",Wells Fargo is experiencing an exodus of mortgage bankers. Insiders explain why.
"May 13, 2021",BTC Mining Difficulty Records New ATH After 21.5% Increase: Report
"May 13, 2021",Financial Daily Dose 5.13.2021 | Top Story: Stocks Continue Slide as CPI Shows Price Jump in U.S.
"May 13, 2021",2 Big Reasons That Interest Rates Will Stall Around 2%
"May 13, 2021",Did One Tweet Wipe $500B Off The Crypto Market In 24 Hours?
"May 13, 2021",Gas crunch continues across much of US after pipeline hack
"May 13, 2021","Amazon seeks to hire 75,000; offers $100 to vaccinated hires"
"May 13, 2021",bZx Protocol Market Cap Achieves $152.77 Million (BZRX)
"May 12, 2021","NA Proactive news snapshot: Gevo, Marrone Bio Innovations, CytoDyn, Mirasol Resources, UPDATE"
"May 12, 2021",Wall Street opens higher following better than expected jobs data
"May 12, 2021",Hut 8 Mining (TSE:HUT) Shares Down 8.7%
"May 12, 2021",Hut 8 Mining (TSE:HUT) Stock Price Down 8.7%
"May 12, 2021",LAWSUIT FILED: Canaan Inc. Sued for Violations of the Federal Securities Laws; Investors Should Contact Block & Leviton LLP
"May 12, 2021",Stocks open higher on Wall Street as Big Tech regains ground
"May 12, 2021",Wall Street set for mixed start amid continued volatility
"May 12, 2021",An Ultimate Guide To Android Bitcoin Mining.
"May 12, 2021","Billionaire investor Stanley Druckenmiller blasted the Fed, touted bitcoin over ethereum, and issued a dire warning about the dollar in a recent interview. Here are the 10 best quotes."
"May 12, 2021",5 Ways to Play the New Crypto Craze
"May 12, 2021",Gasoline pipeline shutdown tests Biden administration
"May 12, 2021","The Zacks Analyst Blog Highlights: Maxim Integrated Products, Silicon Laboratories, MACOM Technology Solutions, NVIDIA and Texas Instruments"
"May 11, 2021","Zacks Industry Outlook Highlights: Polaris, Harley-Davidson, Fox Factory and Tesla"
"May 11, 2021",Dozens of startups raised hundreds of millions to go public with a SPAC or IPO after taking government loans from the pandemic
"May 11, 2021","Fintech Focus For May 13, 2021"
"May 11, 2021","INVESTOR ACTION ALERT: The Schall Law Firm Reminds Investors of a Class Action Lawsuit Against Canaan Inc. and Encourages Investors with Losses in Excess of $100,000 to Contact the Firm"
"May 11, 2021",Is An Incompetent Employee Spreading a Virus Throughout Your Organization? Here's What to Do About It.
"May 11, 2021","President Biden Should Reappoint Powell as Fed Chair, Now"
"May 11, 2021",UK economy showed resilience ahead of big lockdown easing
"May 11, 2021",Is There A Bitcoin Supply Shortage?
"May 11, 2021",Millions of Americans Out of Work But Companies Can't Find Workers? Here's Why
"May 11, 2021",Palantir climbs 9% in volatile trading after mixed 1st-quarter earnings report
"May 11, 2021",5 Microchip Stocks to Buy as Supply Shortage Boosts Demand
"May 11, 2021",AECOM (ACM) Stock Down Despite Q2 Earnings & Revenue Beat
"May 11, 2021","Airline Stock Roundup: AZUL's Q1 Underperformance, Gol's Dull Traffic & More"
"May 11, 2021","Ameren (AEE) Q1 Earnings Beat Estimates, Revenues Rise Y/Y"
"May 11, 2021","Amicus' (FOLD) Q1 Loss Wider Than Expected, Sales Up Y/Y"
"May 11, 2021",Aurora Cannabis (ACB) to Post Q3 Earnings: What's in Store?
"May 11, 2021","Axsome's (AXSM) Q1 Earnings Top, AXS-05 Launch in Focus"
"May 11, 2021","Biohaven (BHVN) Q1 Earnings Miss, Nurtec Uptake Remains Strong"
"May 11, 2021","Brighthouse (BHF) Q1 Earnings and Revenues Beat, Rise Y/Y"
"May 11, 2021","Cardiovascular Systems (CSII) Q3 Loss Widens, Gross Margin Dips"
"May 11, 2021","Delek's (DK) Q1 Loss Wider Than Expected, Sales Beat Mark"
"May 11, 2021","Deutsche (DB), JPMorgan (JPM) Sued by Malaysia Over 1MDB"
"May 11, 2021",GEVO Gears Up to Release Q1 Earnings: What's in the Cards?
"May 11, 2021",Halozyme (HALO) Stock Down Despite Q1 Earnings & Sales Beat
"May 11, 2021",International Flavors (IFF) Q1 Earnings & Sales Top Estimates
"May 11, 2021","Intersect ENT (XENT) Q1 Loss Wider Than Expected, Revenues Top"
"May 11, 2021","Kodiak Sciences (KOD) Q1 Earnings Miss, KSI-301 in Focus"
"May 11, 2021","Macerich (MAC) Sees Strong Demand, Inks Two Store Leases"
"May 11, 2021",Manitowoc (MTW) Shares Up 6% Despite Reporting Q1 Loss
"May 11, 2021",Mogo (MOGO) to Report Q1 Earnings: What's in the Offing?
"May 11, 2021","Novavax's (NVAX) Q1 Loss Widens, Revenues Beat, Shares Down"
"May 11, 2021","Occidental (OXY) Q1 Loss Narrower Than Expected, Sales Top"
"May 11, 2021","Perrigo (PRGO) Q1 Earnings Miss Estimates, Revenues In Line"
"May 11, 2021",Phillips 66 Partners (PSXP) Units Recover Since Q1 Earnings Miss
"May 11, 2021","Scientific Games (SGMS) Q1 Loss Narrows Y/Y, Revenues Rise"
"May 11, 2021",Spain adopts landmark law to protect 'gig' delivery workers
"May 11, 2021","TransDigm's (TDG) Q2 Earnings Beat Estimates, Sales Down Y/Y"
"May 11, 2021",Tyson raising pay to keep up as US chicken demand soars
"May 11, 2021","Veritiv (VRTV) Shares Gain on Q1 Earnings Beat, Upbeat View"
"May 10, 2021","Voya Financial's (VOYA) Q1 Earnings Miss, Revenues Beat"
"May 10, 2021",Wynn Resorts (WYNN) Q1 Earnings & Revenues Miss Estimates
"May 10, 2021",1.4B but no more? China's population growth closer to zero
"May 10, 2021",3 Domestic Auto Stocks in Fast Lane Despite Chip Crunch
"May 10, 2021",Big-Tech Bloodbath Continues After Biggest Sell-Program In History
"May 10, 2021",China reports population growth closer to zero in 2020
"May 10, 2021","SHAREHOLDER ACTION NOTICE: The Schall Law Firm Reminds Investors of a Class Action Lawsuit Against Canaan Inc. and Encourages Investors with Losses in Excess of $100,000 to Contact the Firm"
"May 10, 2021",Tesla stock tumbles as China sales decline 27% in April
"May 10, 2021",US Motorists Urged Not to Panic at Pumps
"May 09, 2021",Pipeline hit by cyberattack could be back by week's end
"May 09, 2021",The Latest: Alabama to end virus unemployment boosts
"May 08, 2021",The Latest: Michigan poised to ease rules on in-office work
"May 08, 2021","EBON INVESTORS WHO LOST MONEY: HAGENS BERMAN, National Trial Attorneys, Encourages Ebang International Holdings (EBON) Investors with Losses to Contact Its Attorneys Now, Securities Class Action Filed"
"May 08, 2021",SHPING Market Cap Achieves $5.17 Million (SHPING)
"May 08, 2021",SHPING Price Hits $0.0033 (SHPING)
"May 08, 2021","SHAREHOLDER ACTION REMINDER: The Schall Law Firm Reminds Investors of a Class Action Lawsuit Against Canaan Inc. and Encourages Investors with Losses in Excess of $100,000 to Contact the Firm"
"May 08, 2021",US says 'Russia-based' group DarkSide behind pipeline hack
"May 08, 2021",Vaccine deserts: Some countries have no COVID-19 jabs at all
"May 08, 2021",Dogecoin Crashed 30% From ATH After Elon Musk's SNL Appearance
"May 07, 2021","Elon Musk Jokes About Dogecoin On 'SNL,' Cryptocurrency Plunges"
"May 07, 2021",Are You On A Fixed Income? You're In BIG Trouble. Here's Why.
"May 07, 2021","A last waltz for Yahoo and AOL, and Elon's crypto comedy show"
"May 07, 2021",bZx Protocol Market Cap Hits $175.97 Million (BZRX)
"May 07, 2021",SHPING (SHPING) 24-Hour Trading Volume Hits $1.98 Million
"May 07, 2021",SHPING (SHPING) Trading 90% Higher Over Last 7 Days
"May 07, 2021",Riot Blockchain (NASDAQ:RIOT) Stock Price Down 10%
"May 07, 2021","TaxWatch: One culprit in IRS backlog of 1.7 million tax returns? Broken printers and copiers, watchdog report says"
"May 06, 2021",Iran Reportedly Bans Trading Of Bitcoin Mined Abroad
"May 06, 2021",Blockchain Week in Review - April 2021 #4
"May 06, 2021","Dow, S&P 500 close at record highs after dismal jobs report gives Fed more breathing room"
"May 06, 2021",Iran's Central Bank Banned Trading Of Foreign-Mined BTC
"May 06, 2021",Tech stocks jump after bad April jobs-report miss dampens inflation fears
"May 06, 2021","Zacks Value Investor Highlights: Bunge, JPMorgan, Beazer Homes, MarineMax and ArcelorMittal"
"May 06, 2021","Beyond Meat's Q1 hobbled by marketing costs, lower prices"
"May 06, 2021",Is Credit Suisse Stock Fairly Priced?
"May 06, 2021","In the News: Small Businesses Add 235,000 Jobs in April"
"May 06, 2021",5 Tax Tips Every Cryptocurrency Investor Needs to Know Now
"May 06, 2021",The Latest: NYC mayor plans to keep ordering vaccines
"May 06, 2021",Will Warren Buffett Have the Last Laugh?
"May 06, 2021","A decline in Tesla's regulatory credit sales could be devastating to its future profitability, strategist says"
"May 05, 2021","Dow adds more than 300 points to record close, Nasdaq turns positive in afternoon jump"
"May 05, 2021",Dow soars 318 points to record high as investors weigh new economic-recovery data
"May 05, 2021",Existential Economic Threats: How U.S. States Can Survive Without Federal Money
"May 05, 2021",Hut 8 Mining (TSE:HUT) Trading Up 0.2%
"May 05, 2021",Jeff Auxier's Auxier Asset Management Spring 2021 Market Commentary
"May 05, 2021",Tesla's Credit Revenue Loss 'Devastating' - Strategist
"May 05, 2021",US stocks trade mixed as investors weigh jobless-claims data
"May 05, 2021",Wall Street makes mixed start despite better than expected jobs data
"May 05, 2021",Wall Street mixed at midday despite better than expected jobs data
"May 05, 2021",Goldman Sachs Leads $15 Million Investment Round In Bitcoin Data Provider Coin Metrics
"May 05, 2021",THESE Are Warren Buffett's 5 Biggest Stocks! Watch As He Calls For Heavy Inflation!
"May 05, 2021","Devon Energy, General Motors rise; Peloton, Exelon fall"
"May 05, 2021","Facebook board upholds Trump ban, just not indefinitely"
"May 05, 2021","Kessler Topaz Meltzer & Check, LLP: Securities Fraud Class Action Filed Against Canaan Inc."
"May 05, 2021",Top Glove hopes to resolve U.S. seizure of its rubber gloves
"May 05, 2021",2:00PM Water Cooler 5/5/2021
"May 05, 2021",April Flowers Have Investors Cheering Wow-sers!
"May 05, 2021",bZx Protocol (BZRX) Trading Up 22.5% This Week
"May 05, 2021",Nio's Posting For Blockchain Expert In US Triggers Crypto Speculation
"May 05, 2021",States push back against use of facial recognition by police
"May 04, 2021","GM expects big 2021 profit, says it's managing chip shortage"
"May 04, 2021",GM profit surges to $2.98B on sales of higher-margin trucks
"May 04, 2021",Joseph Phua's Turn Capital acquires Dapp Pocket to create SEA-focused retail crypto exchange
"May 04, 2021","Kessler Topaz Meltzer & Check, LLP: Securities Fraud Class Action Lawsuit Filed Against Ebang International Holdings Inc."
"May 04, 2021","Rosen, A Global and Leading Law Firm, Encourages Canaan Inc. Investors with Losses to Secure Counsel Before Important Deadline - CAN"
"May 04, 2021",US stocks close mixed with tech lower as traders weigh economic-recovery data
"May 04, 2021",'Of Course I Hate The Bitcoin Success': Miners Embed Charlie Munger Quote Into Blockchain Forever
"May 04, 2021",Economic Downturn Fueling Argentine Crypto Craze
"May 04, 2021",How companies rip off poor employees — and get away with it
"May 03, 2021",bZx Protocol Reaches Market Cap of $155.39 Million (BZRX)
"May 03, 2021",Regulating Blockchain
"May 03, 2021",SHPING Trading 99.7% Higher Over Last 7 Days (SHPING)
"May 03, 2021",Wage theft: His paycheck bounced. It got worse from there.
"May 03, 2021",Bracing for the Next Wave of Delaware Unclaimed Property Reform: Review of SB 103 and SB 104
"May 03, 2021","Skyrocketing Lumber Prices Have Increased The Average Price Of A New Home By $35,872 In 1 Year"
"May 03, 2021","Third-party ransomware risk is real, but Black Kite's latest tool can help"
"May 03, 2021",What Is Cryptomining?
"May 03, 2021",Price of EVERYTHING Up But What's the REAL Reason? Commodities Supercycle or Price Gouge?
"May 03, 2021",The Tesla 'Autonomy Story Is Falling Apart' - Shortseller
"May 03, 2021",Growth in US manufacturing slowed in April from March high
"May 02, 2021",7 ETFs Up At Least 5% Last Week
"May 01, 2021",bZx Protocol (BZRX) Market Cap Tops $164.23 Million
"May 01, 2021",Insider Q&A: Ex-biodefense chief on stopping the next COVID
"May 01, 2021",Privacy & Cybersecurity Update - April 2021
"May 01, 2021",Get Ready For The Most Painful Inflation Since The Jimmy Carter Years Of The 1970s
"Apr 30, 2021","SHAREHOLDER ALERT: The Gross Law Firm Notifies Shareholders of Canaan Inc. of a Class Action Lawsuit and a Lead Plaintiff Deadline of June 14, 2021 - CAN"
"Apr 30, 2021","Last Week's Notable Insider Buys: Beacon Roofing, Chipotle, IPOs, Latham And More"
"Apr 30, 2021",Here's why Apple shouldn't let developers have their own app stores
"Apr 30, 2021",Bill Maher Says Bitcoin Is an Environment-Destroying Ponzi Scheme (Video)
"Apr 30, 2021",THIS Real Estate Tax Loophole Could Be Stopped and Pop the Real Estate Bubble
"Apr 30, 2021","Kessler Topaz Meltzer & Check, LLP Reminds Canaan Inc. Investors of Important Deadline in Securities Fraud Class Action Lawsuit"
"Apr 30, 2021",SHPING Price Hits $0.0012 on Top Exchanges (SHPING)
"Apr 30, 2021",SHPING (SHPING) Trading 69.8% Higher This Week
"Apr 30, 2021",Riot Blockchain (NASDAQ:RIOT) Trading Down 6.8%
"Apr 30, 2021","ROSEN, NATIONAL TRIAL LAWYERS, Encourages Canaan Inc. Investors with Losses to Secure Counsel Before Important Deadline CAN"
"Apr 30, 2021","Why Does Bitcoin's Price Make Random, Sudden Downward Moves?"
"Apr 30, 2021",Censored Russian News Agency Asks For Bitcoin Donations
"Apr 30, 2021",Crypto as the New Inflation Hedge
"Apr 30, 2021",Coinbase lets you pay for bitcoin and other cryptos with PayPal
"Apr 30, 2021","Twitter, Clorox fall; Carter's, AstraZeneca rise"
"Apr 30, 2021",Exxon posts $2.7B quarterly profit after unprecedented year
"Apr 30, 2021",SHPING (SHPING) Price Reaches $0.0010 on Top Exchanges
"Apr 29, 2021",SHPING (SHPING) Price Up 105.7% This Week
"Apr 29, 2021",Asian shares slip on pandemic worries despite Wall St rally
"Apr 29, 2021",GM spending on Mexico electric vehicle plant angers US union
"Apr 29, 2021","May Day Return for the Silver Raid, Price of Silver to Hit $30?"
"Apr 29, 2021","NASDAQ:BTBT Long Term Investor Alert: Investigation of Potential Wrongdoing at Bit Digital, Inc."
"Apr 29, 2021",NASDAQ:CAN Investor Notice: Lawsuit Alleges Misleading Statements by Canaan Inc.
"Apr 29, 2021",Wichtige Zukunftstrends für Finanzinstitute - Internationale Banking Trends KW 17-2021
"Apr 29, 2021",Peer-To-Peer Bitcoin Trading Rising Across Africa
"Apr 29, 2021","NA Proactive news snapshot:Zynerba Pharmaceuticals, Nerds On Site, Marvel Discovery, Water Tower Research UPDATE"
"Apr 29, 2021",5 ETFs That Skyrocketed During Biden's 100 Days in Office
"Apr 29, 2021","EBON CLASS ACTION DEADLINE: HAGENS BERMAN, National Trial Attorneys, Alerts Ebang International Holdings (EBON) Investors to Securities Fraud Lawsuit and Advises Investors with Losses to Contact Its Attorneys Now"
"Apr 28, 2021",Gone Fission: Controversial nuke plant near NYC shuts down
"Apr 28, 2021",NZ Rugby votes to sell commercial share to US investors
"Apr 28, 2021","Ransomware explained: No silver bullet, out-of-reach crooks"
"Apr 28, 2021",Royal Farms Offers $500 Signing Bonus As Labor Shortage Intensifies
"Apr 28, 2021",Total securities damages awarded increased to $4.2 billion in 2020
"Apr 28, 2021","U.S. jobless claims drop 13,000 to 553,000"
"Apr 28, 2021",Why Your Grocery Bills Are Going Up (And Are Only Expected to Get Bigger)
"Apr 27, 2021","3 reasons why ether is outperforming bitcoin, and why the trend can continue, according to JPMorgan"
"Apr 27, 2021",Bitcoin vs Gold: The Great Debate
"Apr 27, 2021","Boeing posts 1Q loss, takes a hit on Air Force One work"
"Apr 27, 2021",Our Long and Mutually Beneficial Detente Ended on 3/16/2021
"Apr 27, 2021",Tesla To Amend Application For Berlin Gigafactory: What You Need To Know
"Apr 27, 2021","HIVE Blockchain Technologies Ltd. (CVE:HIVE) Director Sells C$1,209,127.50 in Stock"
"Apr 27, 2021","International Assets Investment Management LLC Boosts Stake in Riot Blockchain, Inc. (NASDAQ:RIOT)"
"Apr 27, 2021","Tobias Ebel Sells 315,000 Shares of HIVE Blockchain Technologies Ltd. (CVE:HIVE) Stock"
"Apr 27, 2021",US will pay $44 million in age-bias case by ex-FAA workers
"Apr 27, 2021","Wall Street spikes after Fed keeps rates near zero, but major indices fail to eke out a win"
"Apr 27, 2021",Elon Musk says Tesla sold 10% of its bitcoin to show it's a good alternative to cash - but he isn't selling his personal holding
"Apr 27, 2021",Tesla falls 3% as lack of new vehicle-delivery guidance offsets record profit and Bitcoin proceeds
"Apr 27, 2021",Iran Authorizes Use Of Officially Mined Cryptocurrency For Import Payments
"Apr 27, 2021",Extraterritorial Reach of U.S. Crypto Regulation by the SEC
"Apr 27, 2021","Earnings Results: Tesla's first-quarter sales rise more than 70%, but stock slips"
"Apr 27, 2021",Tesla earnings rocket but not enough to outpace lofty expectations
"Apr 27, 2021","Xi Jinping Forgets Seed Phrase For Digital Yuan Wallet, Loses $2.3 Trillion Equivalent Of Country's Wealth"
"Apr 26, 2021",Iran nuclear talks resume in Vienna amid new complications
"Apr 26, 2021",bZx Protocol Achieves Market Cap of $147.25 Million (BZRX)
"Apr 26, 2021",Elon Musk said that Tesla once bought all the USB cables in the Bay Area for its Model S production
"Apr 26, 2021",Elon Musk says Tesla's logistics problems made 'World War II look trivial'
"Apr 26, 2021",SHPING (SHPING) Trading 505.1% Higher This Week
"Apr 26, 2021","Tesla reports strong earnings, but traders are unimpressed"
"Apr 26, 2021","Tesla sets Q1 earnings record with $438 million in net income, vehicle deliveries up 100 percent"
"Apr 26, 2021","Insider Selling: HIVE Blockchain Technologies Ltd. (CVE:HIVE) Director Sells 315,000 Shares of Stock"
"Apr 26, 2021",Late taxes another troubling sign for electric truck startup
"Apr 26, 2021",Tech stocks slide with new earnings reports coming into focus
"Apr 26, 2021","Liquidity in the bitcoin market should recover quickly after the futures-driven price crash, JPMorgan says"
"Apr 26, 2021","JPMorgan could make its first bitcoin fund available to private rich clients as soon as this summer, report says"
"Apr 26, 2021","Foxconn Admits Won't Create 13,000 Jobs! Manufacturing NOT Coming Back."
"Apr 25, 2021",Gensler Confirmed as SEC Chair - A Look into the 'Crypto Ball'
"Apr 25, 2021","Insider Buying: BTCS Inc. (OTCMKTS:BTCS) CEO Purchases $39,951,300.00 in Stock"
"Apr 25, 2021",SHPING (SHPING) Hits 24-Hour Volume of $2.26 Million
"Apr 25, 2021",Tesla's Earnings Zoom Above Estimates on Record Vehicle Deliveries
"Apr 25, 2021",We Need to Fight Unfair Conditions for Women in Tech
"Apr 24, 2021",Asian shares advance after gains on Wall Street
"Apr 24, 2021",Metal Boom: Copper Hits 10-Year High Amid Supply Constraints And Infrastructure Plans
"Apr 24, 2021","Nasdaq and S&P 500 hit record highs, while the Dow soured in afternoon trading"
"Apr 24, 2021","Shareholder Alert: Kessler Topaz Meltzer & Check, LLP Reminds Shareholders of Securities Fraud Class Action Lawsuit Filed Against Ebang International Holdings Inc."
"Apr 24, 2021",Dogecoin's slide this week after the failed 'doge day' has crypto traders eyeing a replacement for the world's favorite meme token
"Apr 24, 2021","BTCS Inc. (OTCMKTS:BTCS) CEO Charles W. Allen Purchases 7,009 Shares"
"Apr 24, 2021",bZx Protocol (BZRX) Price Tops $0.62 on Exchanges
"Apr 24, 2021","Charles W. Allen Purchases 7,009 Shares of BTCS Inc. (OTCMKTS:BTCS) Stock"
"Apr 23, 2021",SHPING (SHPING) Price Up 535.4% This Week
"Apr 23, 2021",UK Court Considers Craig Wright's Claims Of Inventing BTC
"Apr 23, 2021",Hedge Fund Giant Warns of SPAC Collapse After Betting $1 Billion! Begins Heavy Shorting
"Apr 23, 2021",Liquidation
"Apr 23, 2021","Class Action Alert: Kessler Topaz Meltzer & Check, LLP Reminds CAN Investors for Securities Fraud Class Action Lawsuit"
"Apr 23, 2021",Threats
"Apr 23, 2021",bZx Protocol (BZRX) Reaches One Day Volume of $29.80 Million
"Apr 23, 2021",Turkey probes second crypto exchange as market implodes
"Apr 23, 2021",Turkey Probes Second Crypto Exchange As Market Implodes
"Apr 23, 2021",Who Really Invented Bitcoin? The Question Now Comes Before UK Court
"Apr 23, 2021","Bitcoin Crashes Below $50,000 To Critical Support"
"Apr 23, 2021",'Black Swan' author Nassim Taleb says bitcoin is an open Ponzi scheme and a failed currency
"Apr 23, 2021",Is this Australian computer scientist bitcoin creator Satoshi Nakamoto? A UK court is going to decide.
"Apr 23, 2021","Biogen Inc. Wins Some, Loses Some, in Delaware Chancery Court Corporate Records Suit"
"Apr 23, 2021",Futures Rebound From Cap Gains Tax Selloff
"Apr 23, 2021",Alitalia worker strike cancels flights at Rome's airport
"Apr 23, 2021",Merkel defends lobbying for Wirecard on 2019 China visit
"Apr 23, 2021",Stocks move higher; S&P 500 still on track for weekly loss
"Apr 23, 2021","HAGENS BERMAN, NATIONAL TRIAL ATTORNEYS, Encourages SOS Investors to Contact its Attorneys Now, Securities Fraud Case Pending, Media Notes Company's Failure to Refute Analysts' Allegations"
"Apr 23, 2021","HAGENS BERMAN, NATIONAL TRIAL ATTORNEYS, Reminds Ebang International Holdings (EBON) Investors of Securities Class Action and Encourages Investors with Losses to Contact Its Attorneys, Deadline Approaching"
"Apr 23, 2021","Securities Litigation Update: Southern District of New York Dismisses Putative Securities Class Action Alleging Sale of Unregistered Cryptocurrency, But Risk Remains for Crypto-Issuers and Exchanges"
"Apr 23, 2021","SHPING (SHPING) Market Cap Hits $974,889.89"
"Apr 23, 2021",SHPING (SHPING) Price Hits $0.0006 on Exchanges
"Apr 23, 2021","Talking Biz News Today — April 23, 2021"
"Apr 23, 2021","The Zacks Analyst Blog Highlights: Rocky Brands, United Bancorporation of Alabama, Bassett Furniture, ConocoPhillips and The Community Financial Corp"
"Apr 22, 2021",European Markets Dip Despite Bright Data
"Apr 22, 2021",Filthy Rich: Illinois Billionaires Got Wealthier During Pandemic
"Apr 22, 2021",Stocks edge higher; S&P 500 still on track for weekly loss
"Apr 22, 2021","Stocks rise, erasing most of S&P 500's weekly losses"
"Apr 22, 2021",The legacy of Bernie Madoff
"Apr 22, 2021",US Tax Talk Rattles Stock Markets
"Apr 22, 2021",SEC To LBRY: 'You're Overdue.' Recent Enforcement Action Highlights Evolving SEC Focus On Decentralization
"Apr 22, 2021","CEO Of Turkish Exchange Thodex Flees Country, Leaves User Funds Irretrievable"
"Apr 22, 2021",Bank of England reveals lobbying efforts of ex-PM Cameron
"Apr 22, 2021",Belarus leader heads to Moscow for talks on closer ties
"Apr 22, 2021",German minister denies responsibility in Wirecard scandal
"Apr 22, 2021",US average mortgage rates under 3% for first time since Feb.
"Apr 22, 2021","US jobless claims drop to 547,000, a new post-pandemic low, as layoffs ease with economy improving"
"Apr 22, 2021","Alaska Air (ALK) Q1 Loss Narrower than Expected, Revenues Beat"
"Apr 22, 2021",American Airlines' (AAL) Q1 Loss Narrower Than Expected
"Apr 22, 2021","American Airlines posts $1.25 billion loss, delays new jets"
"Apr 22, 2021","American Electric (AEP) Q1 Earnings Miss, Revenues Up Y/Y"
"Apr 22, 2021",APA Reveals Additional Q1 Financial & Operational Information
"Apr 22, 2021",ASE Technology (ASX) to Post Q1 Earnings: What to Expect?
"Apr 22, 2021","Biogen (BIIB) Q1 Earnings Top, Sales Down as Key Drugs Falter"
"Apr 22, 2021",Chubb (CB) to Report Q1 Earnings: What's in the Offing?
"Apr 22, 2021","Core Labs' (CLB) Q1 Earnings Beat Estimates, Revenues Miss"
"Apr 22, 2021","Genuine Parts (GPC) Q1 Earnings & Sales Top, '21 View Up"
"Apr 22, 2021","Jobless Claims Hit Pandemic Lows; Plus Q1 for T, LUV, AAL"
"Apr 22, 2021","NETGEAR (NTGR) Q1 Earnings Top Estimates, Outlook Raised"
"Apr 22, 2021",Southwest (LUV) Incurs Narrower-Than-Expected Loss in Q1
"Apr 22, 2021",Spirit Airlines (SAVE) Posts Narrower-Than-Expected Q1 Loss
"Apr 22, 2021",Stewart Information (STC) Q1 Earnings & Revenues Rise Y/Y
"Apr 21, 2021",U.S. Small Businesses Gather Pace on Strong Recovery: 5 Picks
"Apr 21, 2021","Valero Energy (VLO) Q1 Earnings Beat Estimates, Revenues Miss"
"Apr 21, 2021",Vale (VALE) to Report Q1 Earnings: What's in the Offing?
"Apr 21, 2021","Zacks Market Edge Highlights: Fastenal, UnitedHealth Group, Logitech, Panasonic and QQQM"
"Apr 21, 2021","Quick hits: Illinois news in brief for Thursday, April 22, 2021"
"Apr 21, 2021",Swiss authority to probe Credit Suisse over trading losses
"Apr 21, 2021","US jobless claims fall to 547,000, another pandemic low"
"Apr 20, 2021",XRP Holders Will Be Key In Ripple Labs Lawsuit: Report
"Apr 20, 2021","Ether Outperforms Bitcoin; Guggenheim, JPMorgan Fear 'Major Correction' In Crypto (Again) As Op-Ex Looms"
"Apr 20, 2021","Bitcoin's momentum will slow for months if it's unable to quickly climb back above the crucial $60,000 level - and 2 main hurdles stand in its way, JPMorgan says"
"Apr 20, 2021",Weitz Funds Value Matters: Remembering What Counts
"Apr 20, 2021",bZx Protocol One Day Trading Volume Hits $50.53 Million (BZRX)
"Apr 20, 2021",IRS Is Cleared to Serve John Doe Summons on Cryptocurrency Exchange
"Apr 20, 2021",Where Should You Be Investing as the Economy Recovers?
"Apr 20, 2021","Why Bitcoin's Price Has Stayed Above $50,000"
"Apr 20, 2021","NYDIG Bought The Recent Bitcoin Dip, Indicates Other Institutions Are Doing The Same"
"Apr 20, 2021",US stocks slump as global COVID-19 cases increase
