dates,titles
"Mar 01, 2018","St. Joe (JOE) Posts Adjusted Loss in Q4, Revenues Rise Y/Y"
"Mar 01, 2018",An ex-YouTube recruiter claims Google discriminated against white and Asian men — then deleted the evidence (GOOG)
"Mar 01, 2018",Cryptocurrency Scams Misleading Marketing - How to Watch Out
"Mar 01, 2018",Highlights From SEC Speaks 2018: Litigation and Enforcement Trends
"Feb 28, 2018",Riot Blockchain (RIOT) Earns News Sentiment Score of -0.08
"Feb 28, 2018",Bitcoin and Bubbles
"Feb 28, 2018",Sponsored post: How Regulation Will Unlock A New Crypto-Boom
"Feb 28, 2018",IRS Whistleblower Post - The Feds Eye Bitcoin Cryptocurrency
"Feb 28, 2018",FCC Enforcement Monitor ~ February 2018
"Feb 28, 2018",Carl Icahn just dunked on Bill Ackman to end one of the most high-profile hedge fund spats in recent memory
"Feb 28, 2018","Deutsche Bank's head of stock trading explains how markets went haywire, why volatility is here to stay, and what investors are actually concerned about (DB)"
"Feb 28, 2018",THE CYBER-SAFETY ZONE: Tip #2 Thoughts on the Equifax Data Breach
"Feb 27, 2018",How To Make Money From The Regulation Of Bitcoin
"Feb 27, 2018",Why Central Banks Are So Scared Of Cryptocurrencies?
"Feb 27, 2018",CRYPTO INSIDER: Exchanges are racing to hire enough staff
"Feb 27, 2018",Bill Gates thinks cryptocurrencies have 'caused deaths in a fairly direct way'
"Feb 27, 2018","For Investors, Puerto Rico Is a Fantasy Blank Slate"
"Feb 27, 2018",JPMorgan BofA Admit 'Disruptive Threat' Of Cryptocurrency To Their Business
"Feb 27, 2018",Highlights from SEC Speaks 2018: Litigation and Enforcement Trends
"Feb 26, 2018",Identillect (TSX-V:ID) (OTCQB:IDTLF) (Frankfurt:8ID) advances Blockchain to ensure the greatest protection for New European and Canadian Regulations
"Feb 26, 2018",Mining Metals 2018: Full speed ahead?
"Feb 26, 2018",The iced tea company that pivoted to blockchain finally hired a board member with crypto expertise as it fights fraud accusations
"Feb 26, 2018",50 Cent Admits He Isn't a Bitcoin Millionaire After All
"Feb 26, 2018",Multi-Billion Dollar Japanese Tech Conglomerate to Process Salaries in Bitcoin
"Feb 25, 2018",Self-Proclaimed Bitcoin Inventor Craig Wright Sued For $5 Billion
"Feb 24, 2018",5 Top Retail Earnings Charts
"Feb 23, 2018",Epazz to Launch Social Media and Workflow Blockchain App Using Its Proprietary Blockchain Storage Technology from the Cordtell Project
"Feb 23, 2018",Op-Ed: The Potentially Fatal Flaw of Open-Source Blockchain Protocols
"Feb 23, 2018",Your Retirement Account Isn't as Safe as You Think
"Feb 23, 2018","50 Cent reportedly told the bankruptcy court that he never owned bitcoin, contrary to a report that he made $8 million in crypto"
"Feb 23, 2018",Dazzled by Bitcoin and Its Underlying Blockchain? Ever Think that We May Be Forging New Chains for Us
"Feb 23, 2018",Cryptocurrency News Feb 26 - Crypto Is For Real
"Feb 23, 2018",Bridging the Week - February 2018 #3
"Feb 23, 2018","Bridging the Week, Featuring Topics on Whistleblowers; AML Staffing; Unlicensed Crypto Exchange; FCA-CFTC FinTech Cooperation"
"Feb 22, 2018","Don't Waste Your Money on Bitcoin, These 3 Stocks Are Better Buys"
"Feb 22, 2018",Riot Blockchain Gets Hit by Another Shareholder Lawsuit
"Feb 22, 2018",Blockport: New Coin Exchange Could Be A Coinbase Killer?
"Feb 22, 2018",Why Didn't People See That Bitconnect Was A Fraud? [Infographic]
"Feb 22, 2018",Economic Sanctions Compliance in the Age of Blockchain
"Feb 22, 2018","United Technologies, Caterpillar Prop Up DJIA Thursday"
"Feb 21, 2018",Bitcoin Price Drops To Zero After Zaif Cryptocurrency Glitch
"Feb 21, 2018","Between Bridges, Featuring Topics on Cybersecurity, Cryptocurrencies and Compliance"
"Feb 21, 2018",Venezuela Launches 'Petros' Cryptocurrency Amid Growing Skepticism
"Feb 21, 2018","10 things you need to know before the opening bell (SPY, SPX, QQQ, DIA, SNAP, WMY)"
"Feb 20, 2018",Everything you need to know about bitcoin
"Feb 20, 2018","Between Bridges - February 19, 2018: CFTC Says Futures Brokerage Firm's Failure to Supervise Led to Unauthorized Cyber Attack; Trader Criminally Charged for Allegedly Misappropriating Employer's Cryptocurrencies"
"Feb 20, 2018",Petro: Can Venezuela's oil-backed cryptocurrency save its economy?
"Feb 14, 2018",Ecommerce Outlook: Strong Holiday Season Launches a Great 2018
"Feb 14, 2018",Even Congress is jumping on the blockchain bandwagon — and IBM is urging it on (IBM)
"Feb 14, 2018","Warning to Consumers on Virtual Currency Risks Issued by EBA, EIOPA and ESMA"
"Feb 14, 2018",Bitcoin cash is surging as other cryptocurrencies fall
"Feb 14, 2018",Riot Blockchain plummets after CNBC investigation finds no evidence of an advertised shareholders meeting (RIOT)
"Feb 14, 2018",Riot Blockchain Stock Falls 33% to Support After CNBC Report
"Feb 14, 2018",Avalon Life on The Importance of Securing a Business with Smart Contracts
"Feb 14, 2018",Regulating the cryptocurrency markets
"Feb 14, 2018",SEC v. PlexCorps — Cyber Unit Enforcement Action Underscores Potential Challenges to Cross-Border Cryptocurrency Enforcement
"Feb 14, 2018",Why KODAKcoin could be the beginning of a new generation of cryptocurrencies
"Feb 14, 2018",Legal Ramifications of Paying Employees with Cryptocurrency
"Feb 14, 2018",5 Retailers Likely to Emerge Winners This Earnings Season
"Feb 14, 2018",Agios (AGIO) Q4 Loss Wider than Expected; Sales Miss
"Feb 14, 2018",Big Oil Firms Finish 2017 on a High Note: What's Ahead?
"Feb 14, 2018",Caterpillar January Sales up 34%: Will the Momentum Sustain?
"Feb 14, 2018","CNO Financial's (CNO) Q4 Earnings Surpass Estimates, Up Y/Y"
"Feb 14, 2018",Credit Suisse (CS) to Face Lawsuit Over Illegal Write-Downs
"Feb 14, 2018",Daimler AG Signals Supply Chain Risks with Shift to EVs
"Feb 14, 2018","Federal Realty (FRT) Q4 FFO Meets, Revenues Top Estimates"
"Feb 14, 2018","GNC Holdings (GNC) Tops Q4 Earnings, Lags Revenue Estimates"
"Feb 14, 2018","GoPro (GPRO) Sees a Rough Start to 2018, Catalysts Limited"
"Feb 14, 2018",Intercept (ICPT) Misses on Q4 Earnings Sales
"Feb 14, 2018",Merck (MRK) Halts Another Late Stage Study on Alzheimer's
"Feb 14, 2018","MetLife (MET) Q4 Earnings Beat, Revenues Miss Estimates"
"Feb 14, 2018",Molson Coors (TAP) Q4 Earnings Sales Rise Y/Y; Stock Gains
"Feb 14, 2018",Monitoring Our Evolving Technology
"Feb 14, 2018","Occidental (OXY) Tops Q4 Earnings Estimates, Issues Guidance"
"Feb 13, 2018","Terex's (TEX) Q4 Earnings Revenues Top Estimates, Up Y/Y"
"Feb 13, 2018",Twilio (TWLO) Surges on Solid Q4 Results and Optimistic View
"Feb 13, 2018","Wearables Drives Fossil (FOSL) in Q4 Earnings, Stock up 80%"
"Feb 13, 2018","Wells Fargo Gains Amid Government Backlash, Berkshire Backing"
"Feb 13, 2018","Western Union (WU) Misses Q4 Earnings, Issues 2018 Guidance"
"Feb 12, 2018",What's in Store for Liberty Global (LBTYA) in Q4 Earnings?
"Feb 12, 2018",An update to FCA's infotainment system is causing a potentially dangerous glitch — and customers are outraged
"Feb 12, 2018",Cleary Discusses SEC's Freeze of Allegedly Fraudulent 'Decentralized Bank' ICO
"Feb 12, 2018","Soros Now 3rd Largest Holder Of Overstock, Buffett Gets Into Teva As Hedge Funds Dump Google Facebook"
"Feb 12, 2018",The Other Side of Harvey and Irma
"Feb 12, 2018","Bitcoin loses some ground on its way back to $10,000"
"Feb 12, 2018",CRYPTO INSIDER: Litecoin is getting ready to fork
"Feb 11, 2018",Mining: What Investors Need to Know
"Feb 11, 2018",Hacked exchange Coincheck faces lawsuit from users demanding release of cryptocurrencies
"Feb 11, 2018",Launch Your Cryptocurrency Exchange Platform Instantly With Blockchain Scaffold! - Ready to Deploy Module To Get Faster Time to Market.
"Feb 10, 2018",JPMorgan Publishes The 'Bitcoin Bible'
"Feb 10, 2018",JPMORGAN WARNS: There's a 'fairly high risk' bitcoin could get cut in half
"Feb 10, 2018","Davor, Bitconnect And Leveraged Bitcoin Buying"
"Feb 10, 2018",Bitcoin: Neither a Borrower Nor a Lender Be
"Feb 09, 2018",Microsoft is developing blockchain tech that lets you manage your digital identity
"Feb 09, 2018",WSGR Fintech Update - February 2018
"Feb 09, 2018",Recent CFTC enforcement actions related to digital assets
"Feb 08, 2018",Massive Equifax Data Breach May Have Leaked Even More Private Data Than Previously Thought
"Feb 08, 2018",Former Bush security advisor warns of coming blockchain war
"Feb 08, 2018",5 ways blockchain technology could impact traditional banking
"Feb 08, 2018",DMG Blockchain Announces Closing of Qualifying Transaction
"Feb 08, 2018",Hong Kong Regulators Send Warnings to Non-Compliant Cryptocurrency Exchanges
"Feb 08, 2018",NVIDIA Cranks-Up GPU Production To Satisfy Gamers And Booming Cryptocurrency Mining Demand
"Feb 08, 2018",Congressman Cleaver Urges Cryptocurrency Companies to Monitor Extremist Groups
"Feb 07, 2018",7 Reasons to Read FTC's 2017 Privacy Data Security Update
"Feb 07, 2018","Equities Research Analysts' Updated EPS Estimates for February, 9th (BCS, BDEV, BFAM, CBK, COO, DLN, EPC, EXPE, FTV, GBTC)"
"Feb 07, 2018","Stull, Stull Brody Announces the Filing of a Class Action Suit on Behalf of Investors in BitConnect"
"Feb 06, 2018","Bitcoin, Ethereum, Ripple Prices Rise Despite Being Called Ponzi Scheme"
"Feb 06, 2018","10 things you need to know before the opening bell (SPY, SPX, QQQ, DIA, SNAP, TSLA)"
"Feb 06, 2018",Why I Am Not Worrying About The Crypto Market Crash
"Feb 06, 2018","News Headlines for Feb 8, 2018"
"Feb 06, 2018","The Market In 5 Minutes: Jobless Claims, Tesla Earnings, VXX Breakdown"
"Feb 06, 2018",Recent ICO Enforcement Trends
"Feb 06, 2018",U.S. equities were again whipsawed
"Feb 05, 2018","Crypto update: Coin prices continue tumble, Singapore remains safe haven for trading"
"Feb 05, 2018",Early Uber investor Shervin Pishevar has been ranting for 21 hours in one tweet storm but it's unclear what the point is
"Feb 03, 2018",Coincheck Hack: Sout Korea Claims North Korea May Have Hacked Cryptocurrency Exchange
"Feb 02, 2018","Ripple (XRP) is centralized and terribly flawed, researchers say"
"Feb 02, 2018",Asian shares routed as 'goldilocks' trade suddenly unwinds
"Feb 02, 2018","News Headlines for Feb 6, 2018"
"Feb 02, 2018","The Market In 5 Minutes: Markets Plummet, Volatility Spikes"
"Feb 02, 2018",Trumphoria and the economy
"Feb 02, 2018",Venezuela: Inflation and woes
"Feb 02, 2018","Bitcoin, Ethereum, Ripple Price Drop: Here's Why"
"Feb 02, 2018",Bridging the Week - February 2018
"Feb 02, 2018","Bridging the Week by Gary DeWaal: January 29 to February 2, and February 5, 2018 (Spoofing; FCMs; Software Development; ICOs; Block Trades) [VIDEO]"
"Feb 02, 2018","China to pull the plug on cryptocurrency, will block all websites related to virtual currency trading"
"Feb 02, 2018",TECH ANALYST: Snap's stock price could get cut in half (SNAP)
"Feb 01, 2018",7 tips for building the ultimate gaming PC
"Feb 01, 2018","ExxonMobil gets whacked, worst performer in Dow (XOM)"
"Feb 01, 2018","Business Litigation Alert: ""SEC Cracking Down on Cryptocurrency Scams"""
"Feb 01, 2018",The Finanser's Week: 29th January 2017 - 4th February 2018
"Feb 01, 2018",NFL Rejects Humorous AML BitCoin Super Bowl Ad Attacking North Korea
"Feb 01, 2018",Wells Fargo Crashes After Fed's Shocking Crackdown Bans Bank From Growing
"Feb 01, 2018",The tech market 'law of gravity' reversed during the holidays and it could be the beginning of the end of the smartphone boom
"Feb 01, 2018",ProBeat: Facebook's Bitcoin ban is baffling
"Feb 01, 2018","The Market In 5 Minutes: Alphabet, Amazon, Apple, Bitcoin, And Flamethrowers"
"Feb 01, 2018",A Chinese conglomerate struggling with billions in debt is reportedly hounding its own employees for money
"Feb 01, 2018",Anatomy of a Ponzi Scheme - BitConnect Scam Post
"Feb 01, 2018",How to Beat the Crypto Scammers
"Feb 01, 2018","10 things you need to know before the opening bell (SPY, SPX, QQQ, DIA, GOOG, AMZN, AAPL, DB)"
"Feb 01, 2018","Facebook Moves to Ban Cryptocurrency Ads, Calling Them 'Misleading or Deceptive'"
"Jan 31, 2018",Riot Blockchain Inc (RIOT) Short Interest Down 6.6% in January
"Jan 31, 2018",The Next Step! Facebook Bans Ads Regarding Cryptocurrency
"Jan 31, 2018",The Rise And Fall Of Bitconnect [Infographic]
"Jan 31, 2018",U.S. equities are on a tear... lower again
"Jan 31, 2018",Venezuela: can a failing state protect its environment and its people?
"Jan 31, 2018",Bitcoin skids to lowest since November after worst month in three years
"Jan 31, 2018",Cryptos Tumble After India Says It Will 'Take All Measures To Eliminate' Their Use
"Jan 31, 2018",Facebook banning cryptocurrency ads to keep malicious scammers at bay
"Jan 31, 2018",Global Regulators Increasingly Shifting Focus to Cryptocurrency
"Jan 31, 2018",10 Biggest Surprises in 2017 Business — And What They Mean for 2018
"Jan 31, 2018",Facebook's ban on cryptocurrency ads all about Litecoin integration
"Jan 31, 2018",Is Facebook's Ban On Crypto Ads In Anticipation Of A Litecoin Integration
"Jan 31, 2018",The Unique Quandaries Faced in Recovering International Cryptocurrency Frauds
"Jan 31, 2018",How To Spot Cryptocurrency Scams
"Jan 31, 2018","10 things you need to know before the opening bell (SPY, SPX, QQQ, DIA, FB, MSFT)"
"Jan 30, 2018","AMD CEO Refocused Company on Growth in Graphics, High-Performance Compute"
"Jan 30, 2018",A round-up of some of the most interesting developments to look out for in 2018 for disputes lawyers
"Jan 30, 2018",Consumer Financial Services: What to Expect in 2018
"Jan 30, 2018",Riot Blockchain Inc (NASDAQ:RIOT) Short Interest Up 50.3% in December
"Jan 30, 2018",The Inflection Point For Stocks And Bonds?
"Jan 30, 2018","Bitcoin slides below $10,000 just as Korea and Facebook announce new crypto cash policies"
"Jan 30, 2018",Bitcoin slumps as Facebook bans cryptocurrency adverts
"Jan 30, 2018",Facebook moves to ban cryptocurrency ads. Bitcoin prices fall at social network censorship
"Jan 30, 2018","Facebook bans all Cryptocurrency adverts Including Bitcoin, ICOs"
"Jan 30, 2018",Blockchain Week in Review - January 2018
"Jan 30, 2018",Facebook bans adverts for cryptocurrencies and ICOs
"Jan 30, 2018",Economic Collapse: Will Cryptocurrency Save The Financial System?
"Jan 30, 2018",Bear of the Day: CF Industries (CF)
"Jan 30, 2018",Biggest Security Breach In Australian History: Top Secret Files Found In Old Cabinet
"Jan 30, 2018",CEO of alleged $600 million crypto fraud: 'I can sleep at night knowing that I did my best'
"Jan 30, 2018",Facebook bans cryptocurrency ads
"Jan 30, 2018",Facebook bans Cryptocurrency ads
"Jan 30, 2018",Can Pharmacy Services Drive CVS Health's (CVS) Q4 Earnings?
"Jan 30, 2018",CFTC Flexes Its Regulatory Muscle in a Case Involving a Virtual Currency
"Jan 30, 2018","Dover (DOV) Tops Q4 Earnings Estimates, Issues 2018 Guidance"
"Jan 29, 2018","Facebook Banned Ads For Cryptocurrency, ICOs, Some Other Financial Products"
"Jan 29, 2018","Franklin (BEN) Q1 Earnings Impress, Tax Charge Recorded"
"Jan 29, 2018","Harley-Davidson (HOG) Q4 Earnings Beat Estimates, Up Y/Y"
"Jan 29, 2018",Higher Consumer Spending Indicates Solid Retail Earnings
"Jan 29, 2018",International Paper (IP) Q4 Earnings: What's in the Offing?
"Jan 29, 2018",Marvell-Cavium Deal Set to Close as HSR Waiting Time Expires
"Jan 27, 2018",Mattel's (MAT) Underperforming Brands to Hurt Q4 Revenues
"Jan 26, 2018",Will Weak Sales Hurt Hershey (HSY) This Earnings Season?
"Jan 26, 2018",Visualizing History's Biggest Crypto-Heists
"Jan 26, 2018","Tuesday News: Whatever He Says at SOTU, Trump is NOT 'Presidential'; Sen. Mark Warner on Andrew McCabe, Russia Investigation; 'Elizabeth Guzman promises lively rebuttal to State of the Union'"
"Jan 26, 2018","Bridging the Week: January 22 to 26, and 29, 2018 (Fake Coins, Real News; 'It Depends' Advice; Market Abuse; Insider Information) [VIDEO]"
"Jan 26, 2018",Bridging the Week - January 2018 #4
"Jan 26, 2018",Coincheck Crypto Exchange Issuing $400M In Refunds To Customers Hit By NEM Hot Wallet Hack
"Jan 26, 2018",The 31-year-old CEO of startup Outcome Health stepped down just 8 months after raising $500 million
"Jan 26, 2018","Caterpillar, Apple Sink the DJIA on Monday"
"Jan 25, 2018",Playchemy unveils blockchain-enabled Immortal Player Characters
"Jan 25, 2018","Bitcoin, Innovation of Money and Reinventing Activism"
"Jan 25, 2018","Bitcoin Mining Cost Lowest In Venezuela, Highest In South Korea, Report Finds"
"Jan 25, 2018",The Other Way To Steal Crypto: Armed Robbers Storm Ontario-Based Bitcoin Firm
"Jan 25, 2018","Cryptocurrency - Japanese Exchange Coincheck Hack Reinforces Need for ""Cold Wallet"""
"Jan 25, 2018",Japanese Crypto Coincheck Exchange Hacked - Expect More Regulation
"Jan 24, 2018",Ranking The Best New Shows On Netflix You Can Stream Right Now
"Jan 24, 2018",This Pennsylvania congressional district looks like 'Goofy kicking Donald Duck'
"Jan 24, 2018",George Soros slams POTUS Trump at Davos
"Jan 24, 2018",New York bar bans the word 'literally'
"Jan 24, 2018",Soros to Google and Facebook: 'Your days are numbered'
"Jan 24, 2018",These top male BBC news presenters are in talks to take a pay cut
"Jan 24, 2018",Trading platform Robinhood will soon allow you to trade cryptocurrencies with no fees
"Jan 23, 2018",Coincheck Hacked: $530 Million In NEM Tokens Stolen
"Jan 23, 2018",Cyber Risk News Trends
"Jan 23, 2018",Gibson Dunn Offers Securities Enforcement Update for 2017
"Jan 23, 2018","Osterweis Capital Management: I Hate to Burst Your Bubble, But"
"Jan 23, 2018",'Forgotten' bitcoin bring 50 Cent new fortune
"Jan 22, 2018","BitConnect hit with class action lawsuit from six victims who lost over $770,000"
"Jan 22, 2018",Janet Yellen Was A Great Fed Chair. So Why Is The Economy Still Broken?
"Jan 22, 2018",Priorities Begin to Emerge for Trump's SEC
"Jan 22, 2018",The maker of Crock-Pot is plunging as people freak out over a character's shocking death on 'This Is Us'
"Jan 22, 2018","Scandinavia's largest bank just banned all its 30,000 employees from trading cryptocurrency"
"Jan 22, 2018",A Modest Plan
"Jan 22, 2018",CFTC's Virtual Currency Task Force Files Suit To Shut Down Another Virtual Currency Scam
"Jan 22, 2018",Wednesday 24 January 2018
"Jan 22, 2018",Futures A Sea Of Green As Dollar Bloodbath Accelerates
"Jan 22, 2018",Investors Try To Buy Virtual Currency Expertise - CFTC Claims Fraud
"Jan 21, 2018","Netflix Helps NASDAQ, SP to New Records"
"Jan 21, 2018","Venezuela calls early election, Maduro to seek second term"
"Jan 21, 2018","The Gold Cartel, Sex Scandals and GATA"
"Jan 21, 2018",Stater and Long Blockchain (LBCC) Stock: 'Real' Disruption in the Cryptocurrency and Forex Trading Landscape
"Jan 19, 2018",SEC Looking Into Companies With Vapid Blockchain Hype
"Jan 19, 2018",FINRA's 2018 Regulatory and Examination Priorities: New Focus on Cryptocurrencies and Initial Coin Offerings
"Jan 19, 2018",Millions of workers may still need to find jobs before we can talk about 'full employment'
"Jan 19, 2018",9 Risk Factors To Consider When Making Digital Currency Investment Decisions
"Jan 19, 2018","Bridging the Week: January 16 to 19 and 22, 2018 (Not Feeling Groovy; Registered Investment Funds and Cryptocurrencies; Bitcoin Investment Schemes; Reg SHO) [VIDEO]"
"Jan 19, 2018","The US Marshals Service Bitcoin Auction, Explained"
"Jan 19, 2018",Cryptos Are Crashing Again
"Jan 19, 2018",CFTC Continues Federal Crackdown On Virtual Currency Fraud Schemes
"Jan 19, 2018",FINRA Prioritizes Cryptocurrency Regulation in 2018
"Jan 18, 2018","Blockchain tech is innovating education, and schools are catching up to the trend"
"Jan 18, 2018",Guarding against the possible Spectre in every machine
"Jan 18, 2018",Mobile Payment Systems to Implement Cryptocurrency Wallet
"Jan 18, 2018","Moody's - Outlook on Financials is Far from Gloomy, But Watch Out For Italy, Sweden, Australia, Canada And Others"
"Jan 18, 2018",QA On Earnings Season
"Jan 18, 2018",SEC and CFTC Enforcement Directors Issue Joint Statement Regarding Virtual Currency Enforcement Actions
"Jan 18, 2018",Death By Blockchain: Most common causes of security breaches
"Jan 17, 2018",Some Indian banks clampdown on accounts linked to cryptoexchanges
"Jan 17, 2018",A Blockchain RegTech Solution to the World's $200 Billion a Year Identity Verification Crisis: Introducing Velix.ID
"Jan 17, 2018",Somewhat Favorable Media Coverage Somewhat Unlikely to Affect Riot Blockchain (RIOT) Stock Price
"Jan 17, 2018",The US government is charging three bitcoin companies with fraud
"Jan 17, 2018",Future Farm Signs Definitive Agreement to Acquire Blockchain Cryptocurrency Application for Cannabis Payment Platform
"Jan 17, 2018",Texas Taking the Lead in State Cryptocurrency Enforcement
"Jan 17, 2018",Attributing Economic Outcomes to Presidents: Year One of Trump
"Jan 17, 2018","Celebrating Another Year, Another Decade for Sidoxia"
"Jan 17, 2018",#ReleaseTheMemo: $1 Million Bounty Offered For Government Spying Doc
"Jan 17, 2018",The rise and fall of Wikileaks
"Jan 17, 2018",TSMC Expects Flat Smartphone Shipments Revenue In 2018
"Jan 17, 2018",Bitcoin Bubble Burst? ETFs in Focus
"Jan 17, 2018",Ethereum Mining Targeted By Satori.Coin.Robber Malware
"Jan 16, 2018",Here's Why The Number Of Cryptocurrency Hedge Funds Could Triple In 2018
"Jan 16, 2018","Talking Biz News Today — Jan. 18, 2018"
"Jan 16, 2018",Tech Trend to Watch Out for in 2018
"Jan 16, 2018","The Market In 5 Minutes: Jobless Claims Fall, Walmart Upgrade, Cryptocurrencies"
"Jan 16, 2018",U.S. equities rotated mostly lower
"Jan 16, 2018",Bitcoin Is A Pyramid Scheme: Ex-Wells Fargo CEO
"Jan 16, 2018","Bridging the Week: January 8 to 12, and 16, 2018 (FINRA Examination Priorities; Crypto-Exchange Suit; Treasury Secretary Speaks Bitcoin) [VIDEO]"
"Jan 16, 2018",CryptoNick And Other YouTubers Blamed For Bitcoin Price Crash
"Jan 16, 2018","Bitcoin Slumps Below $10,000"
"Jan 16, 2018",BitConnect Shut Down: Bitcoin Trading Platform Stops Services
"Jan 16, 2018",How BitConnect pulled the biggest exit scheme in cryptocurrency
"Jan 16, 2018",Why Are The Markets Not Correcting
"Jan 16, 2018",Police detain man accused of stealing US$1.3M-worth of bitcoins in China
"Jan 15, 2018",Public Token Sale Closes in 90 Minutes as AidCoin Raises a Total of $16.5 Million
"Jan 15, 2018",BitConnect Closes Exchange After State Crackdown Over Unregulated Sales
"Jan 15, 2018",How Blockchain Could Change Energy Markets
"Jan 15, 2018",BitConnect Ends Exchange Lending After Regulator Letters
"Jan 15, 2018",Bank of America beats earnings expectations (BAC)
"Jan 14, 2018","Goldman Sachs beats, despite trading woes (GS)"
"Jan 14, 2018",Former Wells Fargo CEO Calls Bitcoin A Pyramid Scheme
"Jan 14, 2018","Why Are Ethereum, Ripple Prices Dropping? Cryptocurrencies Dip As Bitcoin Value Falls"
"Jan 14, 2018",Darknet Chronicles Pt 4: How Money is Exchanged
"Jan 13, 2018","Hackers loot $400,000 of cryptocurrency Stellar Lumen"
"Jan 12, 2018",BitConnect promoters cover their asses as site struggles with server downtime
"Jan 12, 2018",Investors Are Buying Power Stations In Russia To Mine Cryptocurrency
"Jan 12, 2018",After the Global Financial Crisis: Are We Safe Now?
"Jan 12, 2018",Here comes Citi ... (C)
"Jan 12, 2018","Regulators Slap Banks, MSBs and Card Club with AML Violation Penalties"
"Jan 12, 2018",Tuesday 16 January 2018
"Jan 12, 2018",Radware Report Highlights Rise in Ransom Hacks
"Jan 12, 2018",Should Canada add a books and records provision to export controls and economic sanctions laws?
"Jan 12, 2018",New Study Links Price Manipulation to Bitcoin's Insane Surge
"Jan 11, 2018",Regulatory Update and Recent SEC Enforcement Actions
"Jan 11, 2018",Basic income experts predict an important milestone for free money in 2018
"Jan 11, 2018",Kodak may bring crypto coin to India
"Jan 11, 2018",Sunday 1.14.2018 New York Times Digest
"Jan 11, 2018",Ben Yu and Simar Mangat: 'Crypto 101' @Google
"Jan 11, 2018",Ben Yu and Simar Mangat: 'Crypto 101″ @Google
"Jan 11, 2018",How can we properly analyze the complex earnings story?
"Jan 11, 2018",Weighing the Week Ahead: A Confusing Earnings Season
"Jan 11, 2018",The Blockchain Name-Change Game And Securities Fraud
"Jan 11, 2018",One corner of the stock market sees even crazier trading than bitcoin
"Jan 11, 2018",Six Predictions for 2018
"Jan 11, 2018",Is Blockchain Technology Right for Your Business?
"Jan 10, 2018",Facebook slides after saying it will shift its newsfeed function so it's actually 'good for people' (FB)
"Jan 10, 2018",Here comes JPMorgan ... (JPM)
"Jan 10, 2018",JPMorgan lost $143 million on a single trading client in the fourth quarter (JPM)
"Jan 10, 2018","Retail stocks are rising after a report said last year's holiday season was 'better than anything we could have hoped for' (AMZN, TGT, KSS, JWN)"
"Jan 10, 2018",Snap slides after getting hit with another downgrade from Wall Street (SNAP)
"Jan 10, 2018",The 'melt up' continues: Here's a super-quick guide to what traders are talking about right now
"Jan 10, 2018",Open Square Capital 4Q17 Letter To Partners
"Jan 09, 2018","Bitcoin, Ripple, Ethereum, Neo, Litecoin: Price Analysis"
"Jan 09, 2018",Top 3 Chinese tech fails of 2017
"Jan 09, 2018",Financial Services Weekly News - January 2018
"Jan 09, 2018",Litecoin founder Charlie Lee denies claims of insider trading on Coinbase
"Jan 09, 2018",BitConnect handed yet another cease and desist letter - this time in North Carolina
"Jan 09, 2018",Kodak rolls over some of its cryptocurrency gains
"Jan 09, 2018",Billionaire investor Steve Cohen is about to make his return to the hedge fund industry — and he's already amassed a substantial war chest
"Jan 09, 2018",GE has lots of good stuff going on — but it's not enough to turnaround the company just yet (GE)
"Jan 09, 2018",STOCKS HIT A RECORD HIGH: Here's what you need to know
"Jan 08, 2018",Thursday 11 January 2018
"Jan 08, 2018","When Your Bank Fails, Don't Walk Run!"
"Jan 08, 2018","Bitcoin, Blockchain and Consumer Protection Laws"
