dates,titles
"Mar 10, 2020",Are PlusToken Operators Driving Down the Bitcoin Price?
"Mar 10, 2020",Edward Snowden Feels Like Buying BTC On Twitter
"Mar 09, 2020",Crash in Ethereum Price Sends DeFi Ecosystem Into Disarray
"Mar 09, 2020",Tech ETFs at Risk as Coronavirus Mars IDC IT Spending Outlook
"Mar 09, 2020","Bitcoin Plunges Under $6,000 as Global Markets Continue to Crash"
"Mar 08, 2020","Coronavirus spared some assets, a recession isn't certain, and there could be some winners, top economist says"
"Mar 06, 2020","Top Crypto Analyst Explains Why BTC Dropped 17% Since $9,200"
"Mar 06, 2020","Robinhood Crypto Trading App Is Still Down, Second Monday In A Row"
"Mar 05, 2020","Global stock market plunge, US stocks trading halted, but IPSE grows strongly against wind"
"Mar 04, 2020",FBI Arrests Russian Accused Of Heading Hacker 'Storefront'
"Mar 03, 2020",Lloyd's Syndicate to Insure Against Cryptocurrency Hacks
"Mar 03, 2020","CryptoCorner: Bitcoin Plummets, but Not from Coronavirus? HIVE to Expand Swedish Mining Facility and Congressman Introduces Crypto-Currency Act of 2020"
"Mar 03, 2020","'Punched in the face': Oil, stocks, bond yields, and bitcoin plunge after crude producers signal a brutal price war"
"Mar 03, 2020",Goldman Sachs ex-CEO Lloyd Blankfein predicts a 'quick recovery' for markets from coronavirus
"Mar 03, 2020",The entire US yield curve plunged below 1% for the first time ever. Here's why that's a big red flag for investors.
"Mar 03, 2020",These Countries Outlawed Crypto But Then Embraced It
"Mar 03, 2020",Bitcoin Mining Equipment Company Canaan Sued By Investor Alleging Securities Law Violations
"Mar 03, 2020",Consumer Financial Services and Fintech Enforcement Trends in New York
"Mar 03, 2020","ROSEN, A TOP RANKED LAW FIRM, Announces Filing of Securities Class Action Lawsuit Against Canaan Inc. CAN"
"Mar 03, 2020",Bridging The Week - March 2020
"Feb 29, 2020",Goldman Sachs Expects the Fed to Cut Rates: Bullish for Bitcoin
"Feb 28, 2020",Cybersecurity Training Basics
"Feb 28, 2020",NASDAQ: CAN Shareholder Notice: Investigation over Possible Securities Laws Violations by Canaan Inc.
"Feb 28, 2020",US Indicts Two Chinese Nationals For Laundering Cryptocurrency Allegedly Stolen In North Korean Hack
"Feb 27, 2020","US sanctions, charges two Chinese linked to N. Korean hack"
"Feb 27, 2020","US Sanctions, Charges Two Chinese Linked To N. Korean Hack"
"Feb 27, 2020","Bridging the Weeks by Gary DeWaal: February 17 to 28, and March 2, 2020 (Sanctioned Again; Spoofing; Denied Again; Bitcoin ETF)"
"Feb 27, 2020",OKEx And Bitfinex Suffer Simultaneous DDoS Attacks
"Feb 26, 2020",Bitcoin Ransomware Payments Gross $144 Million in Six Years
"Feb 26, 2020",Tether Dismisses Market Manipulations Allegations Calling Them Fake
"Feb 26, 2020",Ex-Microsoft software engineer convicted of embezzling $10 million in digital value
"Feb 26, 2020",No U.S. No Problems: Iranian Commander Calls for Crypto Use to Evade Sanctions
"Feb 25, 2020",Financial institutions MA: Sector trends - February 2020: Consumer Finance
"Feb 25, 2020","When You See What These Kids Are Jumping In, Your Jaw Will Drop! Tabs For Friday, Feb. 28, 2020"
"Feb 25, 2020",DIRTT Drops Over 30 Percent Following Poor Earnings
"Feb 25, 2020",Shareholder Alert: Robbins LLP is Investigating the Officers and Directors of Canaan Inc. (CAN)
"Feb 25, 2020",Steven Seagal Charged For Unlawfully Promoting 2018 ICO
"Feb 25, 2020",Steven Seagal Fined In US Over Cryptocurrency Promotion
"Feb 25, 2020",Crypto Lawyers Fight Over Who Gets To Lead Tether's Lawsuit
"Feb 23, 2020",A former Microsoft engineer stole more than $10 million from the company and used it to buy a $1.6 million lakefront home and a Tesla (MSFT)
"Feb 23, 2020",The Antifragile Bank
"Feb 21, 2020",Utah Considers a Cybersecurity Safe Harbor as Ransomware Runs Riot
"Feb 21, 2020",Who Is Bitcoin Founder Satoshi Nakamoto? Binance CEO Calls Craig Wright 'A Fraud'
"Feb 21, 2020",Blockchain Week in Review - February 2020 #2
"Feb 20, 2020","Expedia cuts 3,000 jobs after pursuing growth too aggressively"
"Feb 20, 2020",Jury convicts ex-Microsoft worker in digital currency scheme
"Feb 20, 2020",Seattle jury convicts former Microsoft worker in digital currency scheme
"Feb 20, 2020","Window On Washington - Vol. 4, Issue 8"
"Feb 20, 2020",Will COVID-19 Lead To A Gold Standard?
"Feb 20, 2020",-$0.18 EPS Expected for Exterran Corp (NYSE:EXTN) This Quarter
"Feb 20, 2020","Blockchain 50 Published, Exchanges Expand Services, Enforcement Actions by SEC, CFTC and International Tax Authorities, Hacks Drive Losses"
"Feb 19, 2020","How to stop bias from creeping into the recruitment process, a diversity expert explains"
"Feb 19, 2020",CFTC charges Colorado man with fraud in digital asset-linked Ponzi scheme
"Feb 19, 2020",FBI Releases IC3 2019 Internet Crime Report
"Feb 19, 2020",Can 'Hijacking' a Single Cryptocurrency Network Violate Antitrust Laws?
"Feb 19, 2020","Talking Biz News Today — February 20, 2020"
"Feb 18, 2020",Can Blockchain Save the Fashion Industry?
"Feb 18, 2020",Ransomware's latest mutations
"Feb 18, 2020","#Sponsored: Fyre, Floyd, Flat Tummy Tea, and Fraud"
"Feb 18, 2020",Top Ten Regulatory and Litigation Risks for Private Funds in 2020
"Feb 14, 2020",Under Armour suffers another blow in heated retail contest
"Feb 14, 2020","Dow Opens at 106.61 - Sure, Continue to Play with Idea of Retirement"
"Feb 13, 2020",Fueling the Fire: How Extortion Has Changed the Face of Data Breaches
"Feb 13, 2020","Get Off Rollercoaster - Reframe ""Retirement"" as Continuum, Not Binary (Working/Not Working)"
"Feb 12, 2020",Rethinking What It Means to Protect Investors in the Digital Asset Space
"Feb 12, 2020",Warren Buffett's right-hand man said that he'd never buy or short Tesla stock
"Feb 12, 2020",Brazilian Crypto Exchanges Crushed Under the Weight of Tough Laws
"Feb 11, 2020","Chinese Exchange Fcoin Closes, Still Owes Users $125 Million"
"Feb 11, 2020",Ripple Will Be The Amazon For Crypto: Brad Garlinghouse
"Feb 10, 2020",Bitcoin Is Back — Amazon-Like Gains Are Ahead
"Feb 10, 2020",'No Rollbacks': BitMEX Says After 62% XRP Flash Crash
"Feb 10, 2020","Insider Buying: XLMedia PLC (LON:XLM) Insider Buys 29,000 in Stock"
"Feb 10, 2020","Former Goldman Sachs intern sues the bank, alleging it fostered a 'fraternity culture' that left him 'grievously injured'"
"Feb 10, 2020",North Korea Is Focused On Mining More Monero Than 2019
"Feb 08, 2020",Apple adds $18 billion in market value after its Chinese factories accelerate post-coronavirus re-openings
"Feb 08, 2020",Individuals Should Not Rely on Insurance to Protect Their Cryptocurrency Holdings
"Feb 08, 2020",Blockchain Litigation Year In Review (Part 2): Lessons From 2019 And What's Ahead For 2020
"Feb 07, 2020",2019 Year in Review: Securities Litigation and Enforcement
"Feb 06, 2020",Moonday Mornings: $4B OneCoin cryptocurrency scam to be made into TV drama
"Feb 06, 2020",Global Markets Decline On Coronavirus Woes
"Feb 05, 2020",Global Markets Mixed On Coronavirus Impact
"Feb 04, 2020",Global Markets Mostly Dip On Coronavirus Woes
"Feb 04, 2020",Blockchain Week in Review - January 2020 #4
"Feb 04, 2020",Atreca (NASDAQ:BCEL) Lifted to #8216;Buy#8217; at BidaskClub
"Feb 03, 2020",First Bancorp (NASDAQ:FNLC) Lowered to Sell at BidaskClub
"Feb 03, 2020",POA Network (POA) Trading Up 4.1% Over Last 7 Days
"Feb 02, 2020",Bitcoin Robbery: 5 Biggest BTC Scams In History
"Feb 02, 2020",Zacks Investment Research Downgrades Franklin Financial Network (NYSE:FSB) to Sell
"Feb 02, 2020",AMWS: What is an ICO (Initial Coin Offering)?
"Feb 01, 2020",Genbit may Become the BitConnect of Brazil
"Feb 01, 2020","TSLA Enters Correction, Tumbles 12% From Highs"
"Jan 31, 2020",English Court confirms that cryptoassets are property
"Jan 31, 2020",Mastercard's CEO Throws Shade at Facebook's Crypto Project Libra
"Jan 31, 2020",Quantum Lists on NASDAQ a Year After NYSE Dismissal
"Jan 30, 2020",Bitcoin Price Hits Highest Since October Amid Asia Market Plunge
"Jan 30, 2020",The Primary Mechanism Of Your Oppression Is Not Hidden At All
"Jan 30, 2020",$3.41 Billion in Sales Expected for Las Vegas Sands Corp. (NYSE:LVS) This Quarter
"Jan 29, 2020",Footballcoin Market Capitalization Tops $1.23 Million (XFC)
"Jan 29, 2020",Mogo Finance Technology Inc (NASDAQ:MOGO) Expected to Announce Quarterly Sales of $12.82 Million
"Jan 29, 2020",Toronto-Dominion Bank (NYSE:TD) Given Average Recommendation of #8216;Hold#8217; by Brokerages
"Jan 28, 2020",UpBit Exchange Gets Cleared From Fraud Charges
"Jan 28, 2020","US Federal Court Judge Allows UnitedCorp to Continue its Antitrust Suit against Bitmain, Kraken, Roger Ver and the ABC Bitcoin Cash Development Team"
"Jan 28, 2020",How Iran is using bitcoin to dodge Trump's sanctions
"Jan 28, 2020",Tesla vs Bitcoin: Elon Musk's Company Is A Better Investment Than BTC
"Jan 28, 2020",National security wrap
"Jan 28, 2020",Hackers keep digitally breaking into people's homes and spying on them through popular Amazon doorbell device Ring. And experts say the hacks are likely to continue.
"Jan 27, 2020",Policyholders Face Substantial Challenges in Obtaining Coverage for Cyber Claims Under First-Party Property Policies
"Jan 27, 2020",Firms Push Back Against Proposed Bitcoin Cash Tax on Miners
"Jan 27, 2020",OneCoin Ponzi Scheme Used Fake Reviews On TrustPilot And Quora
"Jan 27, 2020",Weekly Investment Analysts' Ratings Changes for Square (SQ)
"Jan 26, 2020",$0.55 EPS Expected for HD Supply Holdings Inc (NASDAQ:HDS) This Quarter
"Jan 24, 2020",Iran Has a Bitcoin Strategy to Beat Trump
"Jan 24, 2020",Bitcoin Thieves Get Arrested For Stealing BTC From CoinExchange
"Jan 24, 2020",The Greenback Needs a Digital Makeover
"Jan 21, 2020",$0.28 Earnings Per Share Expected for Twitter Inc (NYSE:TWTR) This Quarter
"Jan 21, 2020",Let Slip the Dogs of Warthe SEC vs. Telegram
"Jan 20, 2020","Blockchain Solutions Announced Across Industries, Crypto Threat Warnings Announced Across Agencies"
"Jan 18, 2020",Blockchain Week in Review - January 2020
"Jan 17, 2020",Grayscale's Bitcoin Products See Massive Institutional Inflows
"Jan 09, 2020",Citi earnings beat estimates as fixed-income trading spikes 49%
"Jan 08, 2020","CryptoCorner: Dish Network Files Blockchain-Based Patent Application, JPMorgan Sees ""High Anticipation"" for Today's CME Group BTC Options Trading Launch"
"Jan 08, 2020","After hackers stole $1M in cryptocurrency, Bellevue venture capitalist launched PR blitz against local company he blames"
"Jan 08, 2020",Square (NYSE:SQ) Stock Rating Lowered by Zacks Investment Research
"Jan 08, 2020",What Libra's 2020 Launch Might Mean For Cryptocurrency
"Jan 08, 2020",Riot Blockchain (NASDAQ:RIOT) Shares Gap Up to $1.30
"Jan 07, 2020",Bloomberg Analyst Explain Why He's Bullish on Bitcoin for 2020
"Jan 07, 2020","Global Stocks, US Futures Surge, Safe Havens Retreat, As US And Iran Signal Peace"
"Jan 07, 2020","Equities Research Analysts' Downgrades for January, 9th (CHRW, SELB, SFE, SHCAY, SHI, SIEN, SJI, SMGZY, SNDX, SQ)"
"Jan 07, 2020",Ethereum dev indicted for delivering cryptocurrency talk in North Korea
"Jan 07, 2020",Research Analysts' Weekly Ratings Updates for Square (SQ)
"Jan 06, 2020",UK money saving expert featured in fake cryptocurrency ads on Instagram — AGAIN!
"Jan 06, 2020","Analysts' Updated EPS Estimates for January, 8th (1COV, BYD, BYND, DEQ, DISH, EL, FOXA, FRU, KBH, PBCT)"
"Jan 06, 2020",Boyd Group Income Fund (TSE:BYD) Downgraded by TD Securities
"Jan 06, 2020","Billionaire hedge fund manager Ken Griffin trounced rival Steve Cohen in 2019 with a 19% return, but both underperformed the stock market"
"Jan 05, 2020",ValuEngine Lowers Mogo Finance Technology (NASDAQ:MOGO) to Hold
"Jan 03, 2020",Bitcoin Billionaire Brock Pierce Endorsing Potential 'Crypto Scam' EXW Wallet
"Jan 03, 2020",CFTC Cracks Down On Another Crypto Ponzi Scheme
"Jan 03, 2020",Almost $300 Million Stolen From Crypto-Exchanges In 2019
"Jan 03, 2020",Two couples whose Ring cameras were hacked have filed a lawsuit seeking class action status against the Amazon company (AMZN)
"Jan 03, 2020",Overnight Risk Rally Fizzles After Iran Vows 'Historic Nightmare' Retaliation
"Jan 03, 2020",Moonday Mornings: Bitmain might lay off half its staff ahead of Bitcoin halving
"Jan 03, 2020",Bitmain Co-founders at Loggerheads Over Mass Layoff Plans
"Jan 03, 2020",Bitmain's former co-CEO speaks out against proposed layoffs
"Jan 02, 2020",XRP Is Climbing: Here Are The Top Three Reasons Why
"Jan 02, 2020",Brokerages Anticipate Mogo Finance Technology Inc (NASDAQ:MOGO) Will Announce Earnings of -$0.15 Per Share
"Jan 02, 2020",Happy Birthday Bitcoin! Here's a Look at Bitcoin's 11th Year by the Numbers
"Jan 01, 2020",How Bitcoin Adoption Will Help India Achieve Its $5 Trillion Economy
"Dec 31, 2019",Bitmain May Soon Cut 50% Of Staff Ahead of Bitcoin Halving
"Dec 30, 2019",Wind of Change - The Year FinTech Came in From the Cold - Polsinelli BitBlog: Year End Edition
"Dec 30, 2019",Top Analyst Believes XRP Price Bottommed And Will Burst Higher
"Dec 30, 2019",5 Ways Marketplace Blockchain is Transforming Ecommerce
"Dec 29, 2019",Riot Blockchain (NASDAQ:RIOT) Shares Down 6.2%
"Dec 27, 2019",Altus Strategies (LON:ALS) Hits New 1-Year High After Insider Buying Activity
"Dec 27, 2019",Berry Petroleum Company LLC (NASDAQ:BRY) Sees Significant Increase in Short Interest
"Dec 27, 2019",Cybersecurity is one of the 7 trends for Blockchain in 2020
"Dec 26, 2019",Is The $2 Billion PlusToken Scam Driving Down The Price Of Bitcoin?
"Dec 26, 2019",Canaan Inc.'s (NYSE:CAN) Quiet Period To End on December 31st
"Dec 25, 2019",Rakuten Group Continues To Embrace Bitcoin: What Is Next?
"Dec 18, 2019","Text, Alexa, Bitcoin—Technology Makes Political Contributions Easier"
"Dec 18, 2019",Former Bitmain Chip Maker in Police Custody for Alleged Embezzlement
"Dec 18, 2019",British Man Accused of Hacking US Health Care Companies
"Dec 17, 2019",PlusToken Saga Continues: $100M ETH Taken Out Of PlusToken's Wallet
"Dec 17, 2019",Blockchain Of Things Startup Latest Target For The SEC Regualtors
"Dec 17, 2019",Rita Ora The Latest Celebrity To Promote Bitcoin On Instagram
"Dec 17, 2019","Bitcoin's slump may have been driven by a billion-dollar Ponzi scheme, miners cashing out, and a volume slump"
"Dec 17, 2019",Chainalysis Worries Over PlusToken Scammers Driving the Bitcoin Price Down
"Dec 17, 2019","Despite Strong Fundamental Trend, Ethereum Price Negative For 2019"
"Dec 17, 2019",BTC Price Falling Today Could Be A Result Of One Chinese Ponzi Scheme
"Dec 16, 2019","Circle Sells OTC Desk To Kraken, Will Focus On Its Stablecoin"
"Dec 16, 2019",Former Kraken Employee Sues The Crypto Exchange For Discrimination
"Dec 16, 2019",Links 12/17/19
"Dec 16, 2019",Bitcoin's failing price could be caused by $2B Chinese Ponzi scheme dumping its crypto
"Dec 16, 2019","Bitcoin Tumbles Below $7,000 Again Sparking Fears of Downward Continuation"
"Dec 16, 2019",HEX Hits Close To Zero-Value Despite Getting Listed On Bitcoin.com
"Dec 16, 2019","Chainalysis: PlusToken Is Dumping on Huobi OTCs, May Be Eating Into BTC Price"
"Dec 16, 2019",Ethereum Price Dives 10% To $131: Here's Why It Crashed
"Dec 15, 2019",The Wild West of Crypto
"Dec 14, 2019","Believe it or not, trading your data for concert tickets or a five-star meal is possible - today"
"Dec 14, 2019","Ethereum Fork Successful, Solutions Target Sneakers and Browsers, EU and NY Consider Regulations, Enforcement Actions Continue"
"Dec 14, 2019",5 Top Weekly NASDAQ Tech Stocks: MMTec Soars Over 22 Percent
"Dec 14, 2019",Former Chip Designer At Bitmain Arrested For Embezzlement
"Dec 13, 2019",A major crypto trader with sole access to $137 million in funds mysteriously died while on vacation. Some outraged users are asking for his body to be exhumed to prove he's actually dead.
"Dec 13, 2019",Financial Daily Dose 12.16.2019 | Top Story: Boeing Execs Mull Halting 737 Max Production as FAA Clearance Stalls
"Dec 13, 2019",ShiftPixy Reports 53 Percent Rise In Revenues Footing US$53M
"Dec 12, 2019",CFTC's Enforcement Division Releases 2019 Annual Report
"Dec 12, 2019",Mogo Finance Technology (NASDAQ:MOGO) Lowered to Hold at ValuEngine
"Dec 12, 2019",US Federal Reserve Will Print And Inject $425 Billion This New Year
"Dec 12, 2019",BTC Miner Producer Canaan's Shares Drop By 40%: Report
"Dec 12, 2019",Mogo Finance Technology (NASDAQ:MOGO) Stock Rating Lowered by ValuEngine
"Dec 11, 2019",Enterprise Blockchain on Bitcoin? Bitfury Is Giving It a Go With Exonum
"Dec 11, 2019",This $722M Bitcoin mining scam referred to its marks as 'dumb' investors and 'sheep'
"Dec 11, 2019",BitClub Network Ponzi Scheme Crashes After Thee Men Get Arrested
"Dec 11, 2019",DOJ arrests four men involved in a $722 million cryptocurrency fraud
"Dec 11, 2019",Poloniex Wallets Emptied As Traders Move Coins To Other Markets
"Dec 10, 2019",Google is under investigation over 'unfair labor practices' by the Labor Board
"Dec 10, 2019",US Arrests Three In Alleged $722 Mn Cryptocurrency Fraud
"Dec 10, 2019",Countdown to the CCPA: Does cyber insurance cover a data breach?
"Dec 04, 2019",Donald G. Lang Sells 200 Shares of CCL Industries Inc. (TSE:CCL.B) Stock
"Dec 03, 2019","Physicians Of Californi Allied Buys 18,539 Shares of Apollo Medical Holdings Inc (NASDAQ:AMEH) Stock"
"Dec 02, 2019",Southside Bancshares (NASDAQ:SBSI) Rating Lowered to Sell at ValuEngine
"Dec 02, 2019",Zacks: Analysts Set $7.00 Target Price for CorePoint Lodging Inc (NYSE:CPLG)
"Dec 02, 2019",AI and Blockchain: A Match Made In Heaven?
"Dec 02, 2019","Italy's UniCredit to cull 8,000 jobs, shutter 500 branches"
"Dec 02, 2019",China's Renewed Crackdown Forces 5 Crypto Exchanges Out of Business
"Dec 02, 2019",Virtual Currency: The Taxman is Coming
"Dec 02, 2019",Allegion (NYSE:ALLE) Hits New 52-Week High After Analyst Upgrade
"Dec 01, 2019","Iran Gets Closer To Strong Financial Crisis, Can Crypto Save The Country?"
"Nov 30, 2019","Italy's Largest Bank In Trouble? UniCredit To Layoff 8,000 Jobs Amid Western Europe Struggles"
"Nov 30, 2019",Galaxy Digital Blames Libra For $68 Million Loss In Q3
"Nov 30, 2019","Despite $68 Million Loss, Novogratz Optimistic About Crypto's Future"
"Nov 29, 2019",HIVE Blockchain gets dumped by PI Financial
"Nov 28, 2019",Brussels Regulatory Brief: November 2019
"Nov 27, 2019",Ethereum's Vitalik Buterin Signs 'Free Virgil Griffith' Petition Despite North Korea Meddling
"Nov 27, 2019",OneCoin Website Shuts Down But Continues Operations
"Nov 27, 2019",SEC Enforcement Report Comes Down Hard on Advisers; Your Chance to Sound Off About the SEC's Proposed Advertising Cash Solicitation Rule Changes; Mutual Funds Placed on SEC's Naughty List: Regulatory Update for December 2019
"Nov 27, 2019",The cryptocurrency community is up in arms after a US citizen gave a talk on blockchain in North Korea and was then arrested
"Nov 26, 2019",Tether Will Still Be Preferred Choice For Traders And Here's Why
"Nov 26, 2019",A cryptocurrency expert was charged with helping North Korea evade sanctions after blockchain talk in Pyongyang
"Nov 26, 2019","Stifel Financial Corp Buys 29,215 Shares of iShares Select Dividend ETF (NASDAQ:DVY)"
"Nov 26, 2019",American Arrested For Presenting Crypto And Blockchain In North Korea
"Nov 25, 2019","China-Based IDAX CEO Goes 'Missing,' Withdrawals Halted"
"Nov 25, 2019",BRICS Nations Discuss Shared Crypto To Break Away From USD And SWIFT
"Nov 25, 2019",Federal Reserve President Thinks Debt Could Hamper Economy: Bitcoin as a Hedge
"Nov 25, 2019",US CFTC Obtained Over $1.3B In Administrative Penalties This Year
"Nov 25, 2019",CFTC Collected $1.3B In Fines This Year
"Nov 25, 2019","Global Markets Grateful For Trade Deal Optimism, Levitate To All Time Highs"
"Nov 24, 2019",Google's Project Cache Could Kill Bitcoin
"Nov 24, 2019",The Impending End Of A Mania
"Nov 23, 2019",Weekly Analysts' Ratings Changes for Global Blood Therapeutics (GBT)
"Nov 22, 2019",Futures Fly On Trade Optimism Amid Barrage Of Megamergers
"Nov 22, 2019","Fold App Emerges From Beta, Adds Delta, Domino's and Others for Sats-Back Rewards"
"Nov 22, 2019",Crypto Traders Rushing to Digital Gold Coins Leave Bitcoin Behind
"Nov 22, 2019","Need to Know: The 'great rotation' will arrive in 2020 and bring another strong year for stocks, JP Morgan says"
"Nov 22, 2019",Tether Faces Another Lawsuit in the Western District of Washington
"Nov 22, 2019",Tether's Volume Is Booming Amid Crypto Market Drop
"Nov 22, 2019","The 'PayPal Mafia' formed in the early 2000s, and includes everyone from Elon Musk to the Yelp founders. Here's where the original members have ended up."
"Nov 21, 2019",Links 11/24/19
"Nov 21, 2019",Second whistleblower exposes cover-up at OPCW Syria chemical weapons report (Video)
"Nov 21, 2019",China Classifies Altcoins As Illegal Despite Embracing Blockchain
"Nov 21, 2019",BTC Mining Equipment Canaan Didn't Raise The $100M: Update
"Nov 20, 2019",PSA: Twitter finally ditches SMS for two-factor authentication
"Nov 20, 2019",Subscription Revenues Drive Ooma's Bottom Line
"Nov 19, 2019",Venezuelan Despot Maduro Says He Has Oil Coming for Petro Cryptocurrency
"Nov 19, 2019",Blockchain Firm Chainalysis Cuts Down 20% Of Workforce
"Nov 18, 2019",Isolated Iceland newly vulnerable to computer scams
"Nov 15, 2019",Russia's FSB linked to $450 million bitcoin loss
"Nov 14, 2019",Another Canadian Crypto Exchange Suffers Lost Funds: $16 Million Missing
"Nov 14, 2019",Mercer International (NASDAQ:MERC) Downgraded to 'Sell' at ValuEngine
"Nov 14, 2019","Morgan Stanley Purchases 9,325 Shares of Riot Blockchain Inc (NASDAQ:RIOT)"
"Nov 14, 2019",Riot Blockchain Inc (NASDAQ:RIOT) Position Increased by Morgan Stanley
"Nov 13, 2019",Swedish gold-for-cryptocurrency scammer finally extradited to US
"Nov 13, 2019",Alleged Cryptocurrency Fraudster Extradited From Thailand to Face Charges in Multi-Million Dollar Investment Scheme
"Nov 13, 2019",HP board unanimously rejects Xerox's takeover bid
"Nov 13, 2019",BitFinex Intends To Dismiss Tether-Related Class Action Lawsuit
"Nov 12, 2019","Baidu, Live Nation Entertainment, CME, MarketAxess and Nasdaq highlighted as Zacks Bull and Bear of the Day"
"Nov 12, 2019",Telegram insists Gram tokens are currency
"Nov 12, 2019",FED Added $12.7 Million Bitcoin To Financial System As Bailout
"Nov 11, 2019",Royal Bank Of Canada May Launch Own Crypto Exchange Platform
"Nov 11, 2019",CFTC Enforcement Priorities: Commodity Trading Advisory Services in Energy and Other Areas Under Scrutiny
"Nov 10, 2019",PayPal Prevents Pornhub Models From Receiving Their Paychecks
"Nov 10, 2019",Airbnb Now Accepts Bitcoin Payments Via Fold App
"Nov 08, 2019",Facebook's black employees say the company has a racism problem
"Nov 08, 2019",This cryptocurrency exchange was actually a $384 million Ponzi scheme
"Nov 08, 2019",Canadian Banking Giant RBC Applies for New Cryptocurrency Sector Patents
"Nov 08, 2019",Deepdotweb admin says $15.5M Bitcoin 'kickback' scheme didn't exist
"Nov 08, 2019",Mexican state oil firm Pemex hit by ransomware attack
"Nov 08, 2019",BTCS (OTCMKTS:BTCS) Stock Price Down 12.6%
"Nov 07, 2019",Facebook must remove fake Bitcoin ads featuring Big Brother creator or pay $1.2M
"Nov 07, 2019",Argentina Sets New Trading Records For BTC Trading
"Nov 07, 2019",ADA Or BCH: Which Coin Is Set To Break From Its Trading Range?
"Nov 06, 2019",The Finanser's Week: 4th November - 10th November 2019
"Nov 06, 2019",Tether Rebuts 'Flawed' Assertion That Bitcoin's 2017 Run Was Manipulation
"Nov 06, 2019",Bitcoin Miner Maker CEO Held Into Custody Over IP Allegations
"Nov 06, 2019",Zip's User Base Soars Above 1.4 Million in Latest Quarter
"Nov 06, 2019",Trezor Wallet Denies Connections With Maduro's Endorsement
"Nov 06, 2019",Tether Responds To The Paper Linked To The 2017 Bull Run
"Nov 06, 2019",Banking Fraud and Scams Grow as Cannabis Business Industry Grows
"Nov 05, 2019",Hut 8 Mining Reports Financial Results for the Third Quarter of 2019
"Nov 05, 2019","Hut 8 Shares up 18 Percent YTD, Profit Margins Increasing"
"Nov 05, 2019",Bitmain Co-Founder Micree Zhan: 'I Was Removed Without Consent'
"Nov 05, 2019",Bridge The Week - November 2019
"Nov 04, 2019",Former Wall Street Executive Is Still Hopeful About Crypto
"Nov 04, 2019",How Decentralized Technology Can Solve Age-Old Business Problems
"Nov 04, 2019",North Korea Set Up A Blockchain Company To Launder Money: UN
"Nov 01, 2019","Einstein Exchange Seized by BCSC, Owes C$16 Million"
"Nov 01, 2019","Bankruptcy Restructuring News Headlines for Wednesday Nov 6, 2019"
"Oct 31, 2019",Mogo Finance Technology (MOGO) Set to Announce Earnings on Thursday
"Oct 31, 2019",Bitcoin (BTC) Price Reaches $11K On Argentinean Crypto Exchange
"Oct 31, 2019",Financial Daily Dose 11.05.2019 | Top Story: Uber Posts Billion-dollar Q3 Losses But Improved Revenue
"Oct 31, 2019","Crypto Exchanges Are Having A Rough Week, Facing Hacks And Lawsuits"
"Oct 31, 2019",Mogo Finance Technology (MOGO) to Release Earnings on Thursday
"Oct 30, 2019","Blockchain Pilots Move Forward in Food Supply Chain, Land Registries and Buying Coffee with Crypto; Regulators Grant Approvals and Continue Enforcement"
"Oct 30, 2019",Why Libra Regulations Will Be Good for Cryptocurrencies
"Oct 30, 2019",Estonian Crypto Exchange DX 'Closed' Due To Potential Merger Sale
"Oct 30, 2019","'Talking Ourselves Into A Recession': Robert Shiller, Catherine Wood Talk Disruptive Innovation, Narrative Economics"
"Oct 29, 2019","Uber used Bitcoin to pay $100K hacker ransom in 2017, court docs confirm"
"Oct 29, 2019",Financial Watchdog Of Malta Warns Of Repeated Offender BTC Scam
"Oct 29, 2019",The never-ending Mt. Gox saga: Cryptocurrency recovery deadline pushed back (again!)
"Oct 29, 2019",Russian Aluminum Plant Set to House Cryptocurrency Mining Farm
"Oct 29, 2019",Two men plead guilty to 2016 Uber and LinkedIn hacks
"Oct 29, 2019",Mt. Gox Rehabilitation Plan Deadline Extended Again
